KEY,COUNTRY,LABORATORY,SEQUENCE,DATE,YEAR,MONTH,DAY,STATION,LATITUDE ddmmmm,LATITUDE dddddd,LONGITUDE ddmmmm,LONGITUDE dddddd,SDEPTH,RUBIN,BIOTATYPE,TISSUE,NO,LENGTH,WEIGHT,DW%,LOI%,MORS_SUBBASIN,HELCOM_SUBBASIN,DATE_OF_ENTRY
"BBFFG1986001",6,"BFFG",1986001,"12/06/86 00:00:00",1986,12,6,"BKIBU1",54.32,54.53,10.08,10.13,20.5,"GADU MOR","F",5,,39,,20.83,92.8,5,15,
"BBFFG1986002",6,"BFFG",1986002,"12/06/86 00:00:00",1986,12,6,"86/ 3",54.29,54.48,10.43,10.72,19.5,"GADU MOR","F",5,,63,,19.53,92.7,5,15,
"BBFFG1986003",6,"BFFG",1986003,"12/07/86 00:00:00",1986,12,7,"BKIBU1",54.37,54.61,10.16,10.26,22.5,"GADU MOR","F",5,,56,,20.04,92.59999999999999,5,15,
"BBFFG1986004",6,"BFFG",1986004,"12/07/86 00:00:00",1986,12,7,"BKIBU1",54.36,54.6,10.45,10.75,27,"GADU MOR","F",5,,66,,18.05,91.3,5,15,
"BBFFG1986005",6,"BFFG",1986005,"12/08/86 00:00:00",1986,12,8,"BARC2",54.58,54.96,14.12,14.19,43,"GADU MOR","F",5,,49,,21.05,92.5,2,2,
"BBFFG1986006",6,"BFFG",1986006,"12/08/86 00:00:00",1986,12,8,"BBHOL3",54.35,54.58,14.51,14.84,52.5,"GADU MOR","F",5,,49,,19.96,93.2,6,6,
"BBFFG1986007",6,"BFFG",1986007,"12/09/86 00:00:00",1986,12,9,"BBHOL4",55.34,55.57,15.23,15.38,70,"GADU MOR","F",5,,56,,26.67,94.8,6,6,
"BBFFG1986008",6,"BFFG",1986008,"12/10/86 00:00:00",1986,12,10,"86/27",55.43,55.72,16.42,16.7,50,"GADU MOR","F",5,,55,,18.98,92.8,4,6,
"BBFFG1986009",6,"BFFG",1986009,"12/10/86 00:00:00",1986,12,10,"86/28",55.4,55.66,16.56,16.93,35.5,"GADU MOR","F",5,,55,,20,92.90000000000001,4,6,
"BBFFG1986010",6,"BFFG",1986010,"12/11/86 00:00:00",1986,12,11,"86/30",55.56,55.94,17.02,17.04,50,"GADU MOR","F",5,,55,,18.87,92.2,4,6,
"BBFFG1986011",6,"BFFG",1986011,"12/11/86 00:00:00",1986,12,11,"86/31",55.58,55.97,17.19,17.32,39,"GADU MOR","F",5,,64,,18.87,93.40000000000001,4,6,
"BBFFG1986012",6,"BFFG",1986012,"12/11/86 00:00:00",1986,12,11,"86/32",56.03,56.05,17.39,17.65,62,"GADU MOR","F",5,,56,,18.87,93.09999999999999,4,6,
"BBFFG1986013",6,"BFFG",1986013,"12/11/86 00:00:00",1986,12,11,"86/33",55.55,55.92,17.4,17.67,62,"GADU MOR","F",5,,57,,18.52,92,4,9,
"BBFFG1986014",6,"BFFG",1986014,"12/11/86 00:00:00",1986,12,11,"86/35",55.39,55.66,17.44,17.74,58.5,"GADU MOR","F",5,,59,,32.26,96,4,9,
"BBFFG1986015",6,"BFFG",1986015,"12/12/86 00:00:00",1986,12,12,"86/36",55.18,55.31,17.1,17.16,75.5,"GADU MOR","F",5,,62,,18.83,92.8,4,6,
"BBFFG1986016",6,"BFFG",1986016,"12/12/86 00:00:00",1986,12,12,"86/37",55.17,55.29,16.53,16.88,70.5,"GADU MOR","F",5,,71,,17.51,92.3,4,6,
"BBFFG1986017",6,"BFFG",1986017,"12/12/86 00:00:00",1986,12,12,"86/38",55.11,55.18,16.56,16.94,77,"GADU MOR","F",5,,70,,28.99,95.2,4,6,
"BBFFG1986018",6,"BFFG",1986018,"12/12/86 00:00:00",1986,12,12,"BBHOL5",55.18,55.3,16.32,16.53,66,"GADU MOR","F",5,,49,,20.58,93.8,4,6,
"BBFFG1986019",6,"BFFG",1986019,"12/13/86 00:00:00",1986,12,13,"BBHOL5",54.53,54.88,16.05,16.09,48,"GADU MOR","F",5,,57,,18.87,92.2,6,6,
"BBFFG1986020",6,"BFFG",1986020,"12/13/86 00:00:00",1986,12,13,"86/45",54.47,54.78,15.58,15.97,56,"GADU MOR","F",5,,58,,21.28,93.90000000000001,6,6,
"BBFFG1986021",6,"BFFG",1986021,"12/13/86 00:00:00",1986,12,13,"86/46",54.42,54.69,16,16,52.5,"GADU MOR","F",5,,58,,20.7,93.09999999999999,6,6,
"BBFFG1986022",6,"BFFG",1986022,"12/13/86 00:00:00",1986,12,13,"86/47",54.46,54.77,16.21,16.34,34,"GADU MOR","F",5,,46,,20,93.2,6,6,
"BBFFG1986023",6,"BFFG",1986023,"12/14/86 00:00:00",1986,12,14,"86/48",55.49,55.81,18.13,18.21,81.5,"GADU MOR","F",5,,71,,18.62,93.09999999999999,4,9,
"BBFFG1986024",6,"BFFG",1986024,"12/14/86 00:00:00",1986,12,14,"86/49",55.4,55.66,18.05,18.09,65.5,"GADU MOR","F",5,,65,,17.83,92.5,4,9,
"BBFFG1986025",6,"BFFG",1986025,"12/14/86 00:00:00",1986,12,14,"BROZE9",55.31,55.52,18.12,18.2,84,"GADU MOR","F",5,,62,,18.32,92.90000000000001,4,9,
"BBFFG1986026",6,"BFFG",1986026,"12/14/86 00:00:00",1986,12,14,"BROZE9",55.27,55.45,18.05,18.08,83,"GADU MOR","F",5,,66,,21.6,91.90000000000001,4,9,
"BBFFG1986027",6,"BFFG",1986027,"12/16/86 00:00:00",1986,12,16,"86/56",55.09,55.15,18.42,18.7,99.5,"GADU MOR","F",5,,65,,17.3,92.8,4,9,
"BBFFG1986028",6,"BFFG",1986028,"12/17/86 00:00:00",1986,12,17,"BARC2",54.4,54.67,14.08,14.13,34,"GADU MOR","F",5,,59,,18.48,91.8,2,2,
"BBFFG1986029",6,"BFFG",1986029,"12/17/86 00:00:00",1986,12,17,"BARC2",54.46,54.77,14.02,14.03,41,"GADU MOR","F",5,,58,,21.37,93.90000000000001,2,2,
"BBFFG1986030",6,"BFFG",1986030,"12/06/86 00:00:00",1986,12,6,"BKIBU1",54.32,54.53,10.08,10.13,20.5,"GADU MOR","F",1,,32,,22.68,86.5,5,15,
"BBFFG1986031",6,"BFFG",1986031,"12/12/86 00:00:00",1986,12,12,"86/37",55.17,55.29,16.53,16.88,70.5,"GADU MOR","F",18,,71,,75.76000000000001,99.40000000000001,4,6,
"BBFFG1986032",6,"BFFG",1986032,"12/12/86 00:00:00",1986,12,12,"86/38",55.11,55.18,16.56,16.94,77,"GADU MOR","F",18,,70,,76.34,99.40000000000001,4,6,
"BBFFG1986033",6,"BFFG",1986033,"12/13/86 00:00:00",1986,12,13,"BBHOL5",54.53,54.88,16.05,16.09,48,"GADU MOR","F",18,,57,,74.06999999999999,99.40000000000001,6,6,
"BBFFG1986034",6,"BFFG",1986034,"12/14/86 00:00:00",1986,12,14,"86/48",55.49,55.81,18.13,18.21,81.5,"GADU MOR","F",18,,71,,74.63,99.2,4,9,
"BBFFG1986035",6,"BFFG",1986035,"12/17/86 00:00:00",1986,12,17,"BARC2",54.46,54.77,14.02,14.03,41,"GADU MOR","F",18,,58,,76.34,99.5,2,2,
"BBFFG1986036",6,"BFFG",1986036,"12/06/86 00:00:00",1986,12,6,"86/ 3",54.29,54.48,10.4,10.66,19.5,"LIMA LIM","F",5,,27,,24.39,91.8,5,15,
"BBFFG1986037",6,"BFFG",1986037,"12/07/86 00:00:00",1986,12,7,"86/ 6",54.43,54.72,10.13,10.22,25,"LIMA LIM","F",1,,25,,25.77,87.40000000000001,5,15,
"BBFFG1986038",6,"BFFG",1986038,"12/08/86 00:00:00",1986,12,8,"86/13",54.46,54.77,14.39,14.65,42.5,"PLAT FLE","F",5,,33,,25,95.40000000000001,2,6,
"BBFFG1986039",6,"BFFG",1986039,"12/08/86 00:00:00",1986,12,8,"86/13",54.46,54.77,14.39,14.65,42.5,"CLUP HAR","F",5,,23,,30.86,94.5,2,6,
"BBFFG1986040",6,"BFFG",1986040,"12/10/86 00:00:00",1986,12,10,"86/25",55.46,55.76,16.16,16.27,59.5,"CLUP HAR","F",5,,26,,29.41,93.90000000000001,6,6,
"BBFFG1986041",6,"BFFG",1986041,"12/10/86 00:00:00",1986,12,10,"86/28",55.4,55.66,16.56,16.93,35.5,"CLUP HAR","F",5,,25,,29.41,94,4,6,
"BBFFG1986042",6,"BFFG",1986042,"12/12/86 00:00:00",1986,12,12,"86/37",55.17,55.29,16.53,16.88,70.5,"CLUP HAR","F",5,,27,,29.07,95.09999999999999,4,6,
"BBFFG1986043",6,"BFFG",1986043,"12/13/86 00:00:00",1986,12,13,"86/46",54.42,54.69,16,16,52.5,"CLUP HAR","F",5,,21,,28.57,93.5,6,6,
"BBFFG1986044",6,"BFFG",1986044,"12/14/86 00:00:00",1986,12,14,"86/49",55.4,55.66,18.05,18.09,65.5,"CLUP HAR","F",5,,26,,29.41,93.59999999999999,4,9,
"BBFFG1986045",6,"BFFG",1986045,"12/06/86 00:00:00",1986,12,6,"BKIBU1",54.3,54.5,10.37,10.61,19,"CLUP HAR","F",1,,23,,32.47,92.8,5,15,
"BBFFG1986046",6,"BFFG",1986046,"12/17/86 00:00:00",1986,12,17,"BARC2",54.46,54.77,14.02,14.03,41,"CLUP HAR","F",1,,25,,33.33,92.5,2,2,
"BBFFG1986047",6,"BFFG",1986047,"12/08/86 00:00:00",1986,12,8,"86/13",54.46,54.77,14.39,14.65,42.5,"PLEU PLA","F",5,,30,,20.83,94.2,2,6,
"BBFFG1986048",6,"BFFG",1986048,"12/13/86 00:00:00",1986,12,13,"86/47",54.46,54.77,16.21,16.34,34,"PLEU PLA","F",5,,35,,25.64,95,6,6,
"BBFFG1986049",6,"BFFG",1986049,"12/17/86 00:00:00",1986,12,17,"BARC2",54.51,54.85,13.52,13.87,54,"PLEU PLA","F",5,,0,,22.22,94.09999999999999,2,2,
"BBFFG1986050",6,"BFFG",1986050,"12/07/86 00:00:00",1986,12,7,"86/ 6",54.43,54.72,10.13,10.22,25,"MERL MNG","F",5,,32,,21.28,94.2,5,15,
"BBFFG1987001",6,"BFFG",1987001,"12/08/87 00:00:00",1987,12,8,"BKIBU1",54.33,54.54,10.07,10.12,21.5,"GADU MOR","F",5,,50,,19.34,93,5,15,
"BBFFG1987002",6,"BFFG",1987002,"12/08/87 00:00:00",1987,12,8,"87/ 2",54.3,54.49,10.31,10.51,14.5,"GADU MOR","F",5,,52,,18.59,91.2,5,15,
"BBFFG1987003",6,"BFFG",1987003,"12/08/87 00:00:00",1987,12,8,"BKIBU1",54.32,54.53,10.49,10.82,25.5,"GADU MOR","F",5,,52,,17.7,90.40000000000001,5,15,
"BBFFG1987004",6,"BFFG",1987004,"12/08/87 00:00:00",1987,12,8,"BKIBU1",54.32,54.53,10.5,10.83,21.5,"GADU MOR","F",5,,56,,17.33,92.09999999999999,5,15,
"BBFFG1987005",6,"BFFG",1987005,"12/08/87 00:00:00",1987,12,8,"BKIBU1",54.33,54.55,10.41,10.69,23.5,"GADU MOR","F",5,,0,,18.21,92.40000000000001,5,15,
"BBFFG1987006",6,"BFFG",1987006,"12/09/87 00:00:00",1987,12,9,"87/ 6",54.55,54.92,12.56,12.93,38.5,"GADU MOR","F",5,,0,,19.8,93.09999999999999,2,2,
"BBFFG1987007",6,"BFFG",1987007,"12/09/87 00:00:00",1987,12,9,"87/ 6",54.55,54.92,12.56,12.93,38.5,"GADU MOR","F",5,,0,,18.94,93.2,2,2,
"BBFFG1987008",6,"BFFG",1987008,"12/09/87 00:00:00",1987,12,9,"BARC2",54.56,54.93,13.26,13.44,49,"GADU MOR","F",5,,48,,18.12,92.2,2,2,
"BBFFG1987009",6,"BFFG",1987009,"12/09/87 00:00:00",1987,12,9,"BARC2",55.02,55.04,13.49,13.82,49,"GADU MOR","F",5,,46,,18.25,93.3,2,2,
"BBFFG1987010",6,"BFFG",1987010,"12/09/87 00:00:00",1987,12,9,"BARC2",55.04,55.07,13.35,13.59,45,"GADU MOR","F",5,,45,,18.73,93.7,2,2,
"BBFFG1987011",6,"BFFG",1987011,"12/10/87 00:00:00",1987,12,10,"87/14",55.44,55.74,16.15,16.25,66,"GADU MOR","F",5,,52,,18.02,92.59999999999999,6,6,
"BBFFG1987012",6,"BFFG",1987012,"12/10/87 00:00:00",1987,12,10,"87/14",55.44,55.74,16.15,16.25,66,"GADU MOR","F",5,,36,,17.99,92.7,6,6,
"BBFFG1987013",6,"BFFG",1987013,"12/10/87 00:00:00",1987,12,10,"87/14",55.44,55.74,16.15,16.25,66,"GADU MOR","F",5,,73,,18.55,93.09999999999999,6,6,
"BBFFG1987014",6,"BFFG",1987014,"12/10/87 00:00:00",1987,12,10,"87/15",55.49,55.82,16.34,16.57,55,"GADU MOR","F",5,,43,,18.55,92.3,4,6,
"BBFFG1987015",6,"BFFG",1987015,"12/11/87 00:00:00",1987,12,11,"87/16",55.42,55.7,16.34,16.56,60,"GADU MOR","F",5,,82,,19.19,93.2,4,6,
"BBFFG1987016",6,"BFFG",1987016,"12/11/87 00:00:00",1987,12,11,"87/16",55.42,55.7,16.34,16.56,60,"GADU MOR","F",5,,52,,18.38,92.2,4,6,
"BBFFG1987017",6,"BFFG",1987017,"12/11/87 00:00:00",1987,12,11,"87/17",55.49,55.81,16.54,16.89,45,"GADU MOR","F",5,,55,,19.16,93.90000000000001,4,6,
"BBFFG1987018",6,"BFFG",1987018,"12/11/87 00:00:00",1987,12,11,"87/18",55.51,55.85,17.02,17.04,50,"GADU MOR","F",5,,50,,18.62,92.5,4,6,
"BBFFG1987019",6,"BFFG",1987019,"12/12/87 00:00:00",1987,12,12,"87/19",56,56,17.18,17.31,44,"GADU MOR","F",5,,74,,18.62,93,4,6,
"BBFFG1987020",6,"BFFG",1987020,"12/12/87 00:00:00",1987,12,12,"87/19",56,56,17.18,17.31,44,"GADU MOR","F",5,,49,,18.35,92.59999999999999,4,6,
"BBFFG1987021",6,"BFFG",1987021,"12/12/87 00:00:00",1987,12,12,"87/20",56.04,56.06,17.39,17.65,63,"GADU MOR","F",5,,54,,18.98,93.3,4,6,
"BBFFG1987022",6,"BFFG",1987022,"12/12/87 00:00:00",1987,12,12,"87/21",55.57,55.95,17.42,17.7,65.5,"GADU MOR","F",5,,0,,18.35,93.09999999999999,4,9,
"BBFFG1987023",6,"BFFG",1987023,"12/12/87 00:00:00",1987,12,12,"87/22",55.47,55.78,17.44,17.73,63,"GADU MOR","F",5,,67,,18.18,92.59999999999999,4,9,
"BBFFG1987024",6,"BFFG",1987024,"12/12/87 00:00:00",1987,12,12,"87/22",55.47,55.78,17.44,17.73,63,"GADU MOR","F",5,,49,,18.98,92.5,4,9,
"BBFFG1987025",6,"BFFG",1987025,"12/12/87 00:00:00",1987,12,12,"87/23",55.59,55.98,17.51,17.84,61,"GADU MOR","F",5,,49,,23.98,94.40000000000001,4,9,
"BBFFG1987026",6,"BFFG",1987026,"12/13/87 00:00:00",1987,12,13,"87/24",56.33,56.55,18.4,18.67,42.5,"GADU MOR","F",5,,40,,18.45,92.3,9,9,
"BBFFG1987027",6,"BFFG",1987027,"12/13/87 00:00:00",1987,12,13,"87/24",56.33,56.55,18.4,18.67,42.5,"GADU MOR","F",5,,57,,19.12,92.7,9,9,
"BBFFG1987028",6,"BFFG",1987028,"12/13/87 00:00:00",1987,12,13,"87/24",56.33,56.55,18.4,18.67,42.5,"GADU MOR","F",5,,76,,18.48,90.59999999999999,9,9,
"BBFFG1987029",6,"BFFG",1987029,"12/13/87 00:00:00",1987,12,13,"87/25",56.22,56.37,18.31,18.51,59,"GADU MOR","F",5,,56,,18.83,92.3,4,9,
"BBFFG1987030",6,"BFFG",1987030,"12/13/87 00:00:00",1987,12,13,"87/26",56.16,56.26,18.14,18.23,37.5,"GADU MOR","F",5,,63,,18.21,92.59999999999999,4,9,
"BBFFG1987031",6,"BFFG",1987031,"12/13/87 00:00:00",1987,12,13,"87/27",56.13,56.22,17.52,17.87,66,"GADU MOR","F",5,,52,,18.28,92.7,4,10,
"BBFFG1987032",6,"BFFG",1987032,"12/13/87 00:00:00",1987,12,13,"87/28",56.04,56.06,17.39,17.64,52.5,"GADU MOR","F",5,,47,,17.79,93.09999999999999,4,6,
"BBFFG1987033",6,"BFFG",1987033,"12/14/87 00:00:00",1987,12,14,"87/29",55.5,55.84,18.1,18.17,71,"GADU MOR","F",5,,67,,18.18,92.40000000000001,4,9,
"BBFFG1987034",6,"BFFG",1987034,"12/14/87 00:00:00",1987,12,14,"87/30",55.4,55.66,18.04,18.07,71,"GADU MOR","F",5,,54,,18.21,92.90000000000001,4,9,
"BBFFG1987035",6,"BFFG",1987035,"12/14/87 00:00:00",1987,12,14,"BROZE9",55.33,55.54,17.58,17.97,74,"GADU MOR","F",5,,55,,18.73,92.90000000000001,4,9,
"BBFFG1987036",6,"BFFG",1987036,"12/14/87 00:00:00",1987,12,14,"BROZE9",55.26,55.43,18.03,18.06,79.5,"GADU MOR","F",5,,56,,18.42,92.09999999999999,4,9,
"BBFFG1987037",6,"BFFG",1987037,"12/14/87 00:00:00",1987,12,14,"BROZE9",55.2,55.33,18.18,18.3,81.5,"GADU MOR","F",5,,56,,18.8,92.8,4,9,
"BBFFG1987038",6,"BFFG",1987038,"12/15/87 00:00:00",1987,12,15,"BROZE9",55.07,55.12,18.35,18.58,85,"GADU MOR","F",5,,60,,18.94,93,4,9,
"BBFFG1987039",6,"BFFG",1987039,"12/15/87 00:00:00",1987,12,15,"BROZE9",55.06,55.1,18.13,18.22,70.5,"GADU MOR","F",5,,55,,17.73,92.59999999999999,4,9,
"BBFFG1987040",6,"BFFG",1987040,"12/15/87 00:00:00",1987,12,15,"BROZE9",55.13,55.22,17.53,17.89,61,"GADU MOR","F",5,,66,,21.1,93.3,4,9,
"BBFFG1987041",6,"BFFG",1987041,"12/16/87 00:00:00",1987,12,16,"87/39",55.19,55.31,17.12,17.19,79,"GADU MOR","F",5,,65,,18.98,91.90000000000001,4,6,
"BBFFG1987042",6,"BFFG",1987042,"12/16/87 00:00:00",1987,12,16,"BBHOL5",55.15,55.25,16.42,16.7,75,"GADU MOR","F",5,,55,,18.76,93.3,4,6,
"BBFFG1987043",6,"BFFG",1987043,"12/16/87 00:00:00",1987,12,16,"BBHOL5",55.11,55.18,16.31,16.52,62,"GADU MOR","F",5,,57,,19.49,93.3,4,6,
"BBFFG1987044",6,"BFFG",1987044,"12/16/87 00:00:00",1987,12,16,"BBHOL5",54.52,54.87,16.06,16.11,51,"GADU MOR","F",5,,56,,19.34,92.3,6,6,
"BBFFG1987045",6,"BFFG",1987045,"12/16/87 00:00:00",1987,12,16,"87/44",54.47,54.79,15.58,15.97,54,"GADU MOR","F",5,,58,,21.51,94.59999999999999,6,6,
"BBFFG1987046",6,"BFFG",1987046,"12/17/87 00:00:00",1987,12,17,"87/45",54.42,54.7,15.58,15.96,55.5,"GADU MOR","F",5,,54,,18.42,92.09999999999999,6,6,
"BBFFG1987047",6,"BFFG",1987047,"12/17/87 00:00:00",1987,12,17,"87/45",54.42,54.7,15.58,15.96,55.5,"GADU MOR","F",5,,54,,18.59,92,6,6,
"BBFFG1987048",6,"BFFG",1987048,"12/17/87 00:00:00",1987,12,17,"BBHOL3",54.34,54.57,15.29,15.48,58,"GADU MOR","F",5,,59,,20,93,6,6,
"BBFFG1987049",6,"BFFG",1987049,"12/17/87 00:00:00",1987,12,17,"BBHOL3",54.28,54.47,15.3,15.5,52,"GADU MOR","F",5,,54,,19.19,93.2,6,6,
"BBFFG1987050",6,"BFFG",1987050,"12/17/87 00:00:00",1987,12,17,"BBHOL3",54.28,54.47,15.15,15.24,35,"GADU MOR","F",5,,0,,19.42,92.90000000000001,6,6,
"BBFFG1987051",6,"BFFG",1987051,"12/18/87 00:00:00",1987,12,18,"BBHOL3",54.42,54.7,15.09,15.15,62.5,"GADU MOR","F",5,,60,,21.19,92.90000000000001,6,6,
"BBFFG1987052",6,"BFFG",1987052,"12/18/87 00:00:00",1987,12,18,"BBHOL3",54.36,54.59,15.01,15.02,55.5,"GADU MOR","F",5,,59,,20.7,93.8,6,6,
"BBFFG1987053",6,"BFFG",1987053,"12/18/87 00:00:00",1987,12,18,"BBHOL3",54.38,54.63,14.56,14.94,50,"GADU MOR","F",5,,55,,18.83,92.90000000000001,6,6,
"BBFFG1987054",6,"BFFG",1987054,"12/18/87 00:00:00",1987,12,18,"BBHOL3",54.34,54.57,14.47,14.78,46,"GADU MOR","F",5,,55,,18.83,92.09999999999999,6,6,
"BBFFG1987055",6,"BFFG",1987055,"12/19/87 00:00:00",1987,12,19,"87/55",54.36,54.6,14.32,14.53,28,"GADU MOR","F",5,,62,,23.58,94.40000000000001,2,6,
"BBFFG1987056",6,"BFFG",1987056,"12/19/87 00:00:00",1987,12,19,"BARC2",54.36,54.61,14.14,14.23,27.5,"GADU MOR","F",5,,49,,26.6,95.3,2,2,
"BBFFG1987057",6,"BFFG",1987057,"12/19/87 00:00:00",1987,12,19,"BARC2",54.43,54.72,14.04,14.07,34,"GADU MOR","F",5,,91,,25.38,92.90000000000001,2,2,
"BBFFG1987058",6,"BFFG",1987058,"12/19/87 00:00:00",1987,12,19,"BARC2",54.43,54.72,14.04,14.07,34,"GADU MOR","F",5,,57,,19.23,93,2,2,
"BBFFG1987059",6,"BFFG",1987059,"12/19/87 00:00:00",1987,12,19,"BARC2",54.52,54.86,13.54,13.9,49,"GADU MOR","F",5,,45,,21.65,93,2,2,
"BBFFG1987060",6,"BFFG",1987060,"12/19/87 00:00:00",1987,12,19,"BARC2",55,54.99,14,14,50,"GADU MOR","F",5,,46,,19.61,94.3,2,2,
"BBFFG1987061",6,"BFFG",1987061,"12/19/87 00:00:00",1987,12,19,"BARC2",54.57,54.95,13.58,13.97,51.5,"GADU MOR","F",5,,47,,19.01,92.7,2,2,
"BBFFG1987062",6,"BFFG",1987062,"12/20/87 00:00:00",1987,12,20,"BMEB12",54.3,54.5,11.23,11.38,29,"GADU MOR","F",5,,59,,22.83,93.59999999999999,5,16,
"BBFFG1987063",6,"BFFG",1987063,"12/08/87 00:00:00",1987,12,8,"BKIBU1",54.33,54.54,10.07,10.12,21.5,"GADU MOR","F",18,,50,,68.97,99,5,15,
"BBFFG1987064",6,"BFFG",1987064,"12/08/87 00:00:00",1987,12,8,"87/ 2",54.3,54.49,10.31,10.51,14.5,"GADU MOR","F",18,,52,,60.61,97.90000000000001,5,15,
"BBFFG1987065",6,"BFFG",1987065,"12/08/87 00:00:00",1987,12,8,"BKIBU1",54.32,54.53,10.49,10.82,25.5,"GADU MOR","F",18,,52,,68.48999999999999,98.59999999999999,5,15,
"BBFFG1987066",6,"BFFG",1987066,"12/08/87 00:00:00",1987,12,8,"BKIBU1",54.32,54.53,10.5,10.83,21.5,"GADU MOR","F",18,,56,,64.09999999999999,98.40000000000001,5,15,
"BBFFG1987067",6,"BFFG",1987067,"12/09/87 00:00:00",1987,12,9,"87/ 6",54.55,54.92,12.56,12.93,38.5,"GADU MOR","F",18,,0,,77.52,99.5,2,2,
"BBFFG1987068",6,"BFFG",1987068,"12/09/87 00:00:00",1987,12,9,"BARC2",54.57,54.95,13.39,13.65,50,"GADU MOR","F",18,,50,,76.92,99.5,2,2,
"BBFFG1987069",6,"BFFG",1987069,"12/09/87 00:00:00",1987,12,9,"BARC2",55.02,55.04,13.49,13.82,49,"GADU MOR","F",18,,46,,78.12,99.5,2,2,
"BBFFG1987070",6,"BFFG",1987070,"12/09/87 00:00:00",1987,12,9,"BARC2",55.04,55.07,13.35,13.59,45,"GADU MOR","F",18,,45,,76.92,99.5,2,2,
"BBFFG1987071",6,"BFFG",1987071,"12/10/87 00:00:00",1987,12,10,"87/14",55.44,55.74,16.15,16.25,66,"GADU MOR","F",18,,52,,78.73999999999999,99.5,6,6,
"BBFFG1987072",6,"BFFG",1987072,"12/10/87 00:00:00",1987,12,10,"87/14",55.44,55.74,16.15,16.25,66,"GADU MOR","F",18,,36,,72.45999999999999,99.3,6,6,
"BBFFG1987073",6,"BFFG",1987073,"12/10/87 00:00:00",1987,12,10,"87/14",55.44,55.74,16.15,16.25,66,"GADU MOR","F",18,,73,,78.12,99.5,6,6,
"BBFFG1987074",6,"BFFG",1987074,"12/10/87 00:00:00",1987,12,10,"87/15",55.49,55.82,16.34,16.57,55,"GADU MOR","F",18,,43,,77.52,99.5,4,6,
"BBFFG1987075",6,"BFFG",1987075,"12/11/87 00:00:00",1987,12,11,"87/16",55.42,55.7,16.34,16.56,60,"GADU MOR","F",18,,82,,79.37,99.5,4,6,
"BBFFG1987076",6,"BFFG",1987076,"12/11/87 00:00:00",1987,12,11,"87/16",55.42,55.7,16.34,16.56,60,"GADU MOR","F",18,,52,,76.34,99.5,4,6,
"BBFFG1987077",6,"BFFG",1987077,"12/11/87 00:00:00",1987,12,11,"87/17",55.49,55.81,16.54,16.89,45,"GADU MOR","F",18,,55,,76.92,99.40000000000001,4,6,
"BBFFG1987078",6,"BFFG",1987078,"12/11/87 00:00:00",1987,12,11,"87/18",55.51,55.85,17.02,17.04,50,"GADU MOR","F",18,,50,,74.63,99.40000000000001,4,6,
"BBFFG1987079",6,"BFFG",1987079,"12/12/87 00:00:00",1987,12,12,"87/19",56,56,17.18,17.31,44,"GADU MOR","F",18,,74,,75.76000000000001,99.5,4,6,
"BBFFG1987080",6,"BFFG",1987080,"12/12/87 00:00:00",1987,12,12,"87/19",56,56,17.18,17.31,44,"GADU MOR","F",18,,49,,76.34,99.5,4,6,
"BBFFG1987081",6,"BFFG",1987081,"12/12/87 00:00:00",1987,12,12,"87/20",56.04,56.06,17.39,17.65,63,"GADU MOR","F",18,,54,,75.19,99.40000000000001,4,6,
"BBFFG1987082",6,"BFFG",1987082,"12/12/87 00:00:00",1987,12,12,"87/22",55.47,55.78,17.44,17.73,63,"GADU MOR","F",18,,49,,75.76000000000001,99.40000000000001,4,9,
"BBFFG1987083",6,"BFFG",1987083,"12/12/87 00:00:00",1987,12,12,"87/23",55.59,55.98,17.51,17.84,61,"GADU MOR","F",18,,49,,72.45999999999999,99.3,4,9,
"BBFFG1987084",6,"BFFG",1987084,"12/13/87 00:00:00",1987,12,13,"87/24",56.33,56.55,18.4,18.67,42.5,"GADU MOR","F",18,,57,,75.19,99.40000000000001,9,9,
"BBFFG1987085",6,"BFFG",1987085,"12/13/87 00:00:00",1987,12,13,"87/24",56.33,56.55,18.4,18.67,42.5,"GADU MOR","F",18,,40,,72.45999999999999,99.3,9,9,
"BBFFG1987086",6,"BFFG",1987086,"12/13/87 00:00:00",1987,12,13,"87/24",56.33,56.55,18.4,18.67,42.5,"GADU MOR","F",18,,76,,75.76000000000001,99.2,9,9,
"BBFFG1987087",6,"BFFG",1987087,"12/13/87 00:00:00",1987,12,13,"87/26",56.16,56.26,18.14,18.23,37.5,"GADU MOR","F",18,,63,,75.19,99.40000000000001,4,9,
"BBFFG1987088",6,"BFFG",1987088,"12/13/87 00:00:00",1987,12,13,"87/27",56.13,56.22,17.52,17.87,66,"GADU MOR","F",18,,52,,59.17,99.40000000000001,4,10,
"BBFFG1987089",6,"BFFG",1987089,"12/13/87 00:00:00",1987,12,13,"87/28",56.04,56.06,17.39,17.64,52.5,"GADU MOR","F",18,,47,,74.63,99.40000000000001,4,6,
"BBFFG1987090",6,"BFFG",1987090,"12/14/87 00:00:00",1987,12,14,"87/29",55.5,55.84,18.1,18.17,71,"GADU MOR","F",18,,67,,76.34,99.40000000000001,4,9,
"BBFFG1987091",6,"BFFG",1987091,"12/14/87 00:00:00",1987,12,14,"BROZE9",55.33,55.54,17.58,17.97,74,"GADU MOR","F",18,,55,,76.34,99.5,4,9,
"BBFFG1987092",6,"BFFG",1987092,"12/15/87 00:00:00",1987,12,15,"BROZE9",55.07,55.12,18.35,18.58,85,"GADU MOR","F",18,,60,,75.19,99.40000000000001,4,9,
"BBFFG1987093",6,"BFFG",1987093,"12/15/87 00:00:00",1987,12,15,"BROZE9",55.06,55.1,18.13,18.22,70.5,"GADU MOR","F",18,,55,,75.76000000000001,99.3,4,9,
"BBFFG1987094",6,"BFFG",1987094,"12/16/87 00:00:00",1987,12,16,"87/39",55.19,55.31,17.12,17.19,79,"GADU MOR","F",18,,65,,75.76000000000001,99.5,4,6,
"BBFFG1987095",6,"BFFG",1987095,"12/16/87 00:00:00",1987,12,16,"BBHOL5",55.15,55.25,16.42,16.7,75,"GADU MOR","F",18,,55,,74.06999999999999,99.40000000000001,4,6,
"BBFFG1987096",6,"BFFG",1987096,"12/16/87 00:00:00",1987,12,16,"87/44",54.47,54.79,15.58,15.97,54,"GADU MOR","F",18,,58,,71.43000000000001,99.40000000000001,6,6,
"BBFFG1987097",6,"BFFG",1987097,"12/17/87 00:00:00",1987,12,17,"87/45",54.42,54.7,15.58,15.96,55.5,"GADU MOR","F",18,,54,,72.98999999999999,99.09999999999999,6,6,
"BBFFG1987098",6,"BFFG",1987098,"12/17/87 00:00:00",1987,12,17,"87/45",54.42,54.7,15.58,15.96,55.5,"GADU MOR","F",18,,0,,74.63,99.40000000000001,6,6,
"BBFFG1987099",6,"BFFG",1987099,"12/17/87 00:00:00",1987,12,17,"BBHOL3",54.34,54.57,15.29,15.48,58,"GADU MOR","F",18,,59,,74.06999999999999,99.40000000000001,6,6,
"BBFFG1987100",6,"BFFG",1987100,"12/17/87 00:00:00",1987,12,17,"BBHOL3",54.28,54.47,15.3,15.5,52,"GADU MOR","F",18,,54,,68.03,99.40000000000001,6,6,
"BBFFG1987101",6,"BFFG",1987101,"12/19/87 00:00:00",1987,12,19,"87/55",54.36,54.6,14.32,14.53,28,"GADU MOR","F",18,,62,,73.53,99.40000000000001,2,6,
"BBFFG1987102",6,"BFFG",1987102,"12/19/87 00:00:00",1987,12,19,"BARC2",54.36,54.61,14.14,14.23,27.5,"GADU MOR","F",18,,49,,73.53,99.09999999999999,2,2,
"BBFFG1987103",6,"BFFG",1987103,"12/19/87 00:00:00",1987,12,19,"BARC2",54.43,54.72,14.04,14.07,34,"GADU MOR","F",18,,91,,71.43000000000001,99.3,2,2,
"BBFFG1987104",6,"BFFG",1987104,"12/19/87 00:00:00",1987,12,19,"BARC2",54.43,54.72,14.04,14.07,34,"GADU MOR","F",18,,57,,75.76000000000001,99.5,2,2,
"BBFFG1987105",6,"BFFG",1987105,"12/19/87 00:00:00",1987,12,19,"BARC2",54.52,54.86,13.54,13.9,49,"GADU MOR","F",18,,45,,73.53,99.40000000000001,2,2,
"BBFFG1987106",6,"BFFG",1987106,"12/19/87 00:00:00",1987,12,19,"BARC2",55,54.99,14,14,50,"GADU MOR","F",18,,46,,75.76000000000001,99.5,2,2,
"BBFFG1987107",6,"BFFG",1987107,"12/19/87 00:00:00",1987,12,19,"BARC2",54.57,54.95,13.58,13.97,51.5,"GADU MOR","F",18,,47,,75.19,99.2,2,2,
"BBFFG1987108",6,"BFFG",1987108,"12/15/87 00:00:00",1987,12,15,"BKIBU1",54.31,54.52,10.34,10.57,20.8,"GADU MOR","F",18,,0,,66.23,98.59999999999999,5,15,
"BBFFG1987109",6,"BFFG",1987109,"12/15/87 00:00:00",1987,12,15,"BROZE9",55.29,55.48,18.08,18.13,72.7,"GADU MOR","F",18,,0,,75.76000000000001,99.40000000000001,4,9,
"BBFFG1987110",6,"BFFG",1987110,"12/15/87 00:00:00",1987,12,15,"87/MIX",55.47,55.78,16.4,16.66,55.2,"GADU MOR","F",18,,0,,76.92,99.5,4,6,
"BBFFG1987111",6,"BFFG",1987111,"12/15/87 00:00:00",1987,12,15,"BBHOL3",54.37,54.62,15.17,15.28,45.8,"GADU MOR","F",18,,0,,72.45999999999999,99.3,6,6,
"BBFFG1987112",6,"BFFG",1987112,"12/15/87 00:00:00",1987,12,15,"BARC2",54.56,54.94,13.44,13.74,45.9,"GADU MOR","F",18,,0,,75.76000000000001,99.40000000000001,2,2,
"BBFFG1987113",6,"BFFG",1987113,"12/15/87 00:00:00",1987,12,15,"87/MIX",56.16,56.27,18.06,18.1,49.6,"GADU MOR","F",18,,0,,69.93000000000001,99.40000000000001,4,10,
"BBFFG1987114",6,"BFFG",1987114,"12/15/87 00:00:00",1987,12,15,"87/MIX",56.01,56.01,17.36,17.6,56,"GADU MOR","F",18,,0,,75.19,99.40000000000001,4,6,
"BBFFG1987115",6,"BFFG",1987115,"12/15/87 00:00:00",1987,12,15,"BROZE9",55.07,55.12,18.35,18.58,85,"GADU MOR","F",20,,60,,17.7,92,4,9,
"BBFFG1987116",6,"BFFG",1987116,"12/15/87 00:00:00",1987,12,15,"BROZE9",55.06,55.1,18.13,18.22,70.5,"GADU MOR","F",20,,55,,19.31,89.7,4,9,
"BBFFG1987117",6,"BFFG",1987117,"12/15/87 00:00:00",1987,12,15,"BROZE9",55.13,55.22,17.53,17.89,61,"GADU MOR","F",20,,66,,21.05,90.7,4,9,
"BBFFG1987118",6,"BFFG",1987118,"12/16/87 00:00:00",1987,12,16,"87/39",55.19,55.31,17.12,17.19,79,"GADU MOR","F",20,,65,,20.08,91.90000000000001,4,6,
"BBFFG1987119",6,"BFFG",1987119,"12/19/87 00:00:00",1987,12,19,"BARC2",54.43,54.72,14.04,14.07,34,"GADU MOR","F",20,,91,,19.46,92.09999999999999,2,2,
"BBFFG1987120",6,"BFFG",1987120,"12/10/87 00:00:00",1987,12,10,"87/14",55.44,55.74,16.15,16.25,66,"GADU MOR","F",8,,36,,26.46,85.59999999999999,6,6,
"BBFFG1987121",6,"BFFG",1987121,"12/10/87 00:00:00",1987,12,10,"87/15",55.49,55.82,16.34,16.57,55,"GADU MOR","F",8,,43,,24.51,88.90000000000001,4,6,
"BBFFG1987122",6,"BFFG",1987122,"12/11/87 00:00:00",1987,12,11,"87/16",55.42,55.7,16.34,16.56,60,"GADU MOR","F",8,,52,,25.71,89,4,6,
"BBFFG1987123",6,"BFFG",1987123,"12/11/87 00:00:00",1987,12,11,"87/17",55.49,55.81,16.54,16.89,45,"GADU MOR","F",8,,55,,24.88,89,4,6,
"BBFFG1987124",6,"BFFG",1987124,"12/12/87 00:00:00",1987,12,12,"87/19",56,56,17.18,17.31,44,"GADU MOR","F",8,,74,,26.18,90.3,4,6,
"BBFFG1987125",6,"BFFG",1987125,"12/12/87 00:00:00",1987,12,12,"87/22",55.47,55.78,17.44,17.73,63,"GADU MOR","F",8,,67,,23.7,88.40000000000001,4,9,
"BBFFG1987126",6,"BFFG",1987126,"12/12/87 00:00:00",1987,12,12,"87/22",55.47,55.78,17.44,17.73,63,"GADU MOR","F",8,,49,,23.98,85.59999999999999,4,9,
"BBFFG1987127",6,"BFFG",1987127,"12/13/87 00:00:00",1987,12,13,"87/24",56.33,56.55,18.4,18.67,42.5,"GADU MOR","F",8,,40,,23.92,88.3,9,9,
"BBFFG1987128",6,"BFFG",1987128,"12/13/87 00:00:00",1987,12,13,"87/24",56.33,56.55,18.4,18.67,42.5,"GADU MOR","F",8,,57,,24.27,89.2,9,9,
"BBFFG1987129",6,"BFFG",1987129,"12/13/87 00:00:00",1987,12,13,"87/24",56.33,56.55,18.4,18.67,42.5,"GADU MOR","F",8,,76,,23.75,88.3,9,9,
"BBFFG1987130",6,"BFFG",1987130,"12/14/87 00:00:00",1987,12,14,"BROZE9",55.33,55.54,17.58,17.97,74,"GADU MOR","F",8,,55,,24.81,89.2,4,9,
"BBFFG1987131",6,"BFFG",1987131,"12/14/87 00:00:00",1987,12,14,"BROZE9",55.26,55.43,18.03,18.06,79.5,"GADU MOR","F",8,,56,,24.1,89.2,4,9,
"BBFFG1987132",6,"BFFG",1987132,"12/14/87 00:00:00",1987,12,14,"BROZE9",55.2,55.33,18.18,18.3,81.5,"GADU MOR","F",8,,56,,26.18,90.7,4,9,
"BBFFG1987133",6,"BFFG",1987133,"12/15/87 00:00:00",1987,12,15,"BROZE9",55.06,55.1,18.13,18.22,70.5,"GADU MOR","F",8,,55,,24.1,89.09999999999999,4,9,
"BBFFG1987134",6,"BFFG",1987134,"12/09/87 00:00:00",1987,12,9,"87/ 6",54.55,54.92,12.56,12.93,38.5,"CLUP HAR","F",5,,22,,32.89,95.3,2,2,
"BBFFG1987135",6,"BFFG",1987135,"12/09/87 00:00:00",1987,12,9,"BARC2",54.56,54.93,13.26,13.44,49,"CLUP HAR","F",5,,22,,29.85,94,2,2,
"BBFFG1987136",6,"BFFG",1987136,"12/13/87 00:00:00",1987,12,13,"87/25",56.22,56.37,18.31,18.51,59,"CLUP HAR","F",5,,25,,31.25,96.2,4,9,
"BBFFG1987137",6,"BFFG",1987137,"12/14/87 00:00:00",1987,12,14,"87/29",55.5,55.84,18.1,18.17,71,"CLUP HAR","F",5,,24,,32.05,95.5,4,9,
"BBFFG1987138",6,"BFFG",1987138,"12/14/87 00:00:00",1987,12,14,"BROZE9",55.33,55.54,17.58,17.97,74,"CLUP HAR","F",5,,23,,31.35,95.59999999999999,4,9,
"BBFFG1987139",6,"BFFG",1987139,"12/17/87 00:00:00",1987,12,17,"87/45",54.42,54.7,15.58,15.96,55.5,"CLUP HAR","F",5,,0,,29.94,93.2,6,6,
"BBFFG1987140",6,"BFFG",1987140,"12/17/87 00:00:00",1987,12,17,"87/45",54.42,54.7,15.58,15.96,55.5,"CLUP HAR","F",5,,23,,31.45,95.3,6,6,
"BBFFG1987141",6,"BFFG",1987141,"12/17/87 00:00:00",1987,12,17,"BBHOL3",54.28,54.47,15.15,15.24,35,"CLUP HAR","F",5,,23,,41.32,96.40000000000001,6,6,
"BBFFG1987142",6,"BFFG",1987142,"12/19/87 00:00:00",1987,12,19,"87/55",54.36,54.6,14.32,14.53,28,"CLUP HAR","F",5,,25,,31.55,95.7,2,6,
"BBFFG1987143",6,"BFFG",1987143,"12/11/87 00:00:00",1987,12,11,"87/17",55.49,55.81,16.54,16.89,45,"CLUP HAR","F",1,,22,,27.17,91.7,4,6,
"BBFFG1987144",6,"BFFG",1987144,"12/12/87 00:00:00",1987,12,12,"87/20",56.04,56.06,17.39,17.65,63,"CLUP HAR","F",1,,22,,36.5,94.3,4,6,
"BBFFG1987145",6,"BFFG",1987145,"12/09/87 00:00:00",1987,12,9,"87/ 6",54.55,54.92,12.56,12.93,38.5,"CLUP HAR","F",18,,22,,,0,2,2,
"BBFFG1987146",6,"BFFG",1987146,"12/17/87 00:00:00",1987,12,17,"87/45",54.42,54.7,15.58,15.96,55.5,"CLUP HAR","F",18,,0,,,0,6,6,
"BBFFG1987147",6,"BFFG",1987147,"12/09/87 00:00:00",1987,12,9,"87/ 6",54.55,54.92,12.56,12.93,38.5,"CLUP HAR","F",20,,22,,,0,2,2,
"BBFFG1987148",6,"BFFG",1987148,"12/17/87 00:00:00",1987,12,17,"87/45",54.42,54.7,15.58,15.96,55.5,"CLUP HAR","F",20,,0,,,0,6,6,
"BBFFG1987149",6,"BFFG",1987149,"12/08/87 00:00:00",1987,12,8,"BKIBU1",54.32,54.53,10.5,10.83,21.5,"LIMA LIM","F",5,,32,,22.27,92.5,5,15,
"BBFFG1987150",6,"BFFG",1987150,"12/08/87 00:00:00",1987,12,8,"87/ 2",54.3,54.49,10.31,10.51,14.5,"LAMI SAC","P",51,,0,,10.27,65.8,5,15,
"BBFFG1988001",6,"BFFG",1988001,"12/09/88 00:00:00",1988,12,9,"BKIBU1",54.31,54.52,10.2,10.33,17.8,"GADU MOR","F",5,,60,,21.7,93.09999999999999,5,15,
"BBFFG1988002",6,"BFFG",1988002,"12/10/88 00:00:00",1988,12,10,"BARC2",54.58,54.97,13.27,13.44,46.2,"GADU MOR","F",5,,47,,20.2,92.09999999999999,2,2,
"BBFFG1988003",6,"BFFG",1988003,"12/12/88 00:00:00",1988,12,12,"BBHOL3",54.39,54.65,15.02,15.03,58.7,"GADU MOR","F",5,,44,,21.1,93.2,6,6,
"BBFFG1988004",6,"BFFG",1988004,"12/13/88 00:00:00",1988,12,13,"BROZE9",55.12,55.19,17.56,17.94,62.8,"GADU MOR","F",5,,42,,27,94.3,4,9,
"BBFFG1988005",6,"BFFG",1988005,"12/14/88 00:00:00",1988,12,14,"BROZE9",55.32,55.54,18.01,18.02,80,"GADU MOR","F",5,,0,,19.6,91.90000000000001,4,9,
"BBFFG1988006",6,"BFFG",1988006,"12/15/88 00:00:00",1988,12,15,"4 Stns",55.52,55.86,17.05,17.08,46.8,"GADU MOR","F",5,,46,,22.2,91.90000000000001,4,6,
"BBFFG1988007",6,"BFFG",1988007,"12/17/88 00:00:00",1988,12,17,"3 Stns",54.34,54.57,15.39,15.65,56.5,"GADU MOR","F",5,,45,,21.3,93.09999999999999,6,6,
"BBFFG1988008",6,"BFFG",1988008,"12/18/88 00:00:00",1988,12,18,"4 Stns",55.21,55.34,17.36,17.6,61.9,"GADU MOR","F",5,,0,,21.7,91.7,4,9,
"BBFFG1988009",6,"BFFG",1988009,"12/10/88 00:00:00",1988,12,10,"6",54.55,54.91,12.56,12.94,39.5,"PLAT FLE","F",5,,33,,25,94.90000000000001,2,2,
"BBFFG1988010",6,"BFFG",1988010,"12/09/88 00:00:00",1988,12,9,"BKIBU1",54.3,54.51,10.32,10.54,16.5,"CLUP HAR","F",5,,0,,32.8,95.7,5,15,
"BBFFG1988011",6,"BFFG",1988011,"12/10/88 00:00:00",1988,12,10,"BARC2",54.57,54.95,13.37,13.62,50.5,"CLUP HAR","F",5,,0,,31.5,95.40000000000001,2,2,
"BBFFG1988012",6,"BFFG",1988012,"12/15/88 00:00:00",1988,12,15,"31",55.54,55.9,17.08,17.13,49,"CLUP HAR","F",5,,0,,25.4,95.40000000000001,4,6,
"BBFFG1988013",6,"BFFG",1988013,"12/09/88 00:00:00",1988,12,9,"BKIBU1",54.33,54.56,10.27,10.45,19.2,"LIMA LIM","F",5,,29,,22.7,94.5,5,15,
"BBFFG1988014",6,"BFFG",1988014,"12/09/88 00:00:00",1988,12,9,"BKIBU1",54.33,54.55,10.32,10.54,18.9,"GADU MOR","F",18,,0,,66.59999999999999,97.7,5,15,
"BBFFG1988015",6,"BFFG",1988015,"12/10/88 00:00:00",1988,12,10,"BARC2",54.59,54.99,13.29,13.48,46.3,"GADU MOR","F",18,,0,,76.3,98.59999999999999,2,2,
"BBFFG1988016",6,"BFFG",1988016,"12/14/88 00:00:00",1988,12,14,"BROZE9",55.32,55.54,18.01,18.02,80,"GADU MOR","F",18,,0,,76.90000000000001,97.7,4,9,
"BBFFG1988017",6,"BFFG",1988017,"12/15/88 00:00:00",1988,12,15,"4 Stns",55.52,55.86,17.05,17.08,46.8,"GADU MOR","F",18,,0,,76.90000000000001,99.3,4,6,
"BBFFG1988018",6,"BFFG",1988018,"12/17/88 00:00:00",1988,12,17,"3 Stns",54.34,54.57,15.39,15.65,56.5,"GADU MOR","F",18,,0,,78.09999999999999,97.2,6,6,
"BBFFG1988019",6,"BFFG",1988019,"12/09/88 00:00:00",1988,12,9,"BKIBU1",54.33,54.55,10.32,10.54,18.9,"ARCT ISL","F",43,,0,,15.2,84.40000000000001,5,15,
"BBFFG1988020",6,"BFFG",1988020,"12/09/88 00:00:00",1988,12,9,"BKIBU1",54.33,54.55,10.32,10.54,18.9,"ASTE RUB","B",41,,0,,20.8,56.5,5,15,
"BBFFG1988021",6,"BFFG",1988021,"12/09/88 00:00:00",1988,12,9,"BKIBU1",54.33,54.56,10.27,10.45,19.2,"LAMI SAC","P",51,,0,,13.7,72.2,5,15,
"BBFFG1988022",6,"BFFG",1988022,"12/09/88 00:00:00",1988,12,9,"BKIBU1",54.33,54.55,10.32,10.54,18.9,"FUCU VES","P",51,,0,,19.2,56.5,5,15,
"BBFFG1988023",6,"BFFG",1988023,"12/09/88 00:00:00",1988,12,9,"BKIBU1",54.36,54.6,10.3,10.5,18,"ARCT ISL","F",43,,0,,8.77,76.7,5,15,
"BBFFG1989001",6,"BFFG",1989001,"12/18/89 00:00:00",1989,12,18,"BBHOL5",55.09,55.15,16.36,16.6,58,"SADU ENT","B",41,,0,,34.97,55.8,4,6,
"BBFFG1989002",6,"BFFG",1989002,"12/15/89 00:00:00",1989,12,15,"28,29",55.48,55.79,16.52,16.87,43.5,"SADU ENT","B",41,,0,,32.19,57.4,4,6,
"BBFFG1989003",6,"BFFG",1989003,"12/15/89 00:00:00",1989,12,15,"32,35",55.48,55.8,17.41,17.69,61.8,"SADU ENT","B",41,,0,,35.34,56.5,4,9,
"BBFFG1989004",6,"BFFG",1989004,"12/16/89 00:00:00",1989,12,16,"32,35",55.48,55.8,17.41,17.69,61.8,"SADU ENT","B",41,,0,,24.6,65.59999999999999,4,9,
"BBFFG1989005",6,"BFFG",1989005,"12/17/89 00:00:00",1989,12,17,"BROZE9",55.09,55.14,18.1,18.16,70.5,"SADU ENT","B",41,,0,,23.46,59.2,4,9,
"BBFFG1989006",6,"BFFG",1989006,"12/12/89 00:00:00",1989,12,12,"BKIBU1",54.36,54.6,10.17,10.28,19,"GADU MOR","F",5,,67,2820,21.31,93.5,5,15,
"BBFFG1989007",6,"BFFG",1989007,"12/13/89 00:00:00",1989,12,13,"BARC2",55.01,55.02,13.36,13.6,49.8,"GADU MOR","F",5,,48,1080,22.11,93.8,2,2,
"BBFFG1989008",6,"BFFG",1989008,"12/19/89 00:00:00",1989,12,19,"BBHOL3",54.33,54.55,15.2,15.33,50.6,"GADU MOR","F",5,,63,2750,22.11,93.90000000000001,6,6,
"BBFFG1989009",6,"BFFG",1989009,"12/14/89 00:00:00",1989,12,14,"BBHOL4",55.42,55.7,15.05,15.08,62,"GADU MOR","F",5,,53,1440,21.54,93.5,6,6,
"BBFFG1989010",6,"BFFG",1989010,"12/18/89 00:00:00",1989,12,18,"BBHOL5",55.11,55.18,16.31,16.52,54.5,"GADU MOR","F",5,,48,1200,22.43,93.90000000000001,4,6,
"BBFFG1989011",6,"BFFG",1989011,"12/15/89 00:00:00",1989,12,15,"27",55.51,55.85,16.56,16.93,44.5,"GADU MOR","F",5,,52,1430,22.28,94,4,6,
"BBFFG1989012",6,"BFFG",1989012,"12/16/89 00:00:00",1989,12,16,"36",56.13,56.22,18.15,18.24,42.5,"GADU MOR","F",5,,60,2170,20.68,93.09999999999999,4,9,
"BBFFG1989013",6,"BFFG",1989013,"12/15/89 00:00:00",1989,12,15,"34",55.53,55.89,17.42,17.7,62.5,"GADU MOR","F",5,,49,1330,21.69,94,4,9,
"BBFFG1989014",6,"BFFG",1989014,"12/17/89 00:00:00",1989,12,17,"BROZE9",55.07,55.11,18.16,18.26,74.8,"GADU MOR","F",5,,60,2210,22.35,94,4,9,
"BBFFG1989015",6,"BFFG",1989015,"12/17/89 00:00:00",1989,12,17,"BROZE9",55.07,55.11,18.16,18.26,74.8,"GADU MOR","F",5,,62,2470,21.94,94.40000000000001,4,9,
"BBFFG1989016",6,"BFFG",1989016,"12/12/89 00:00:00",1989,12,12,"BKIBU1",54.36,54.6,10.17,10.28,19,"GADU MOR","F",18,,67,2820,69.28,99.09999999999999,5,15,
"BBFFG1989017",6,"BFFG",1989017,"12/13/89 00:00:00",1989,12,13,"BARC2",55.01,55.02,13.36,13.6,49.8,"GADU MOR","F",18,,41,1080,78.93000000000001,99.5,2,2,
"BBFFG1989018",6,"BFFG",1989018,"12/19/89 00:00:00",1989,12,19,"BBHOL3",54.33,54.55,15.2,15.33,50.6,"GADU MOR","F",18,,63,2750,75.28,99.40000000000001,6,6,
"BBFFG1989019",6,"BFFG",1989019,"12/14/89 00:00:00",1989,12,14,"BBHOL4",55.42,55.7,15.05,15.08,62,"GADU MOR","F",18,,53,1440,78.75,99.5,6,6,
"BBFFG1989020",6,"BFFG",1989020,"12/18/89 00:00:00",1989,12,18,"BBHOL5",55.11,55.18,16.31,16.52,54.5,"GADU MOR","F",18,,48,1200,76.28,99.40000000000001,4,6,
"BBFFG1989021",6,"BFFG",1989021,"12/15/89 00:00:00",1989,12,15,"27",55.51,55.85,16.56,16.93,44.5,"GADU MOR","F",18,,52,1430,75.18000000000001,99.40000000000001,4,6,
"BBFFG1989022",6,"BFFG",1989022,"12/16/89 00:00:00",1989,12,16,"36",56.13,56.22,18.14,18.24,42.5,"GADU MOR","F",18,,60,2170,76.90000000000001,99.40000000000001,4,9,
"BBFFG1989023",6,"BFFG",1989023,"12/15/89 00:00:00",1989,12,15,"34",55.53,55.89,17.42,17.7,62.5,"GADU MOR","F",18,,49,1330,78.81,99.2,4,9,
"BBFFG1989024",6,"BFFG",1989024,"12/17/89 00:00:00",1989,12,17,"BROZE9",55.07,55.11,18.16,18.26,74.8,"GADU MOR","F",18,,60,2210,76.48,99.5,4,9,
"BBFFG1989025",6,"BFFG",1989025,"12/17/89 00:00:00",1989,12,17,"BROZE9",55.07,55.11,18.16,18.26,74.8,"GADU MOR","F",18,,62,2470,76.22,99.40000000000001,4,9,
"BBFFG1989026",6,"BFFG",1989026,"12/13/89 00:00:00",1989,12,13,"BARC2",55.01,55.02,13.36,13.6,49.8,"PLAT FLE","F",5,,30,369,23.38,94.2,2,2,
"BBFFG1989027",6,"BFFG",1989027,"12/12/89 00:00:00",1989,12,12,"BKIBU1",54.36,54.59,10.19,10.31,19.1,"FUCU VES","P",51,,0,,12.94,47.4,5,15,
"BBFFG1989028",6,"BFFG",1989028,"12/17/89 00:00:00",1989,12,17,"BROZE9",55.07,55.11,18.16,18.26,74.8,"CLUP HAR","F",5,,24,121.6,28.06,94.7,4,9,
"BBFFG1989029",6,"BFFG",1989029,"12/20/89 00:00:00",1989,12,20,"BKIBU1",54.37,54.62,10.2,10.34,19,"CLUP HAR","F",5,,20,67.59999999999999,26.77,94.40000000000001,5,15,
"BBFFG1989030",6,"BFFG",1989030,"12/12/89 00:00:00",1989,12,12,"BKIBU1",54.36,54.59,10.19,10.31,19.1,"CLUP HAR","F",5,,21,56.9,31.18,95.8,5,15,
"BBFFG1989031",6,"BFFG",1989031,"12/13/89 00:00:00",1989,12,13,"BARC2",55.01,55.02,13.36,13.6,49.8,"CLUP HAR","F",5,,22,77.59999999999999,26.18,95.59999999999999,2,2,
"BBFFG1989032",6,"BFFG",1989032,"12/19/89 00:00:00",1989,12,19,"BBHOL3",54.33,54.55,15.2,15.33,50.6,"CLUP HAR","F",5,,20,,28.29,94.7,6,6,
"BBFFG1989033",6,"BFFG",1989033,"12/14/89 00:00:00",1989,12,14,"BBHOL4",55.42,55.7,15.05,15.08,62,"CLUP HAR","F",5,,24,97.09999999999999,28.92,94.8,6,6,
"BBFFG1989034",6,"BFFG",1989034,"12/18/89 00:00:00",1989,12,18,"BBHOL5",55.11,55.19,16.29,16.48,55.5,"CLUP HAR","F",5,,21,81.59999999999999,28.36,94.90000000000001,4,6,
"BBFFG1989035",6,"BFFG",1989035,"12/16/89 00:00:00",1989,12,16,"36",56.13,56.22,18.15,18.24,42.5,"CLUP HAR","F",5,,22,93.8,40.99,96.8,4,9,
"BBFFG1989036",6,"BFFG",1989036,"12/15/89 00:00:00",1989,12,15,"34",55.53,55.89,17.42,17.7,62.5,"CLUP HAR","F",5,,23,82,27.9,94.5,4,9,
"BBFFG1989037",6,"BFFG",1989037,"12/12/89 00:00:00",1989,12,12,"BKIBU1",54.36,54.6,10.17,10.28,19,"LIMA LIM","F",5,,24,164,22.82,94.09999999999999,5,15,
"BBFFG1989038",6,"BFFG",1989038,"12/12/89 00:00:00",1989,12,12,"BKIBU1",54.36,54.6,10.17,10.28,19,"LIMA LIM","F",5,,24,104,23.99,94.3,5,15,
"BBFFG1989039",6,"BFFG",1989039,"12/12/89 00:00:00",1989,12,12,"BKIBU1",54.36,54.59,10.21,10.35,19,"MACO BAL","B",43,"38",5,,9.82,77.5,5,15,
"BBFFG1989040",6,"BFFG",1989040,"12/12/89 00:00:00",1989,12,12,"BARC2",55.02,55.04,13.45,13.75,48.8,"MACO BAL","B",43,"31",4,,8.300000000000001,82.7,2,2,
"BBFFG1989041",6,"BFFG",1989041,"12/18/89 00:00:00",1989,12,18,"3 Stns",55.09,55.15,13.36,13.6,49.8,"MACO BAL","B",43,"270",1,,68.59,9.1,2,2,
"BBFFG1989042",6,"BFFG",1989042,"12/12/89 00:00:00",1989,12,12,"BKIBU1",54.36,54.59,10.21,10.35,19,"MACO BAL","B",42,"38",5,,84.39,4.8,5,15,
"BBFFG1989043",6,"BFFG",1989043,"12/12/89 00:00:00",1989,12,12,"BARC2",55.02,55.04,13.45,13.75,48.8,"MACO BAL","B",42,"100",4,,87.55,4.8,2,2,
"BBFFG1989044",6,"BFFG",1989044,"12/13/89 00:00:00",1989,12,13,"BARC2",55.04,55.07,13.36,13.61,47.9,"MYTI EDU","B",43,,0,,13.48,84.40000000000001,2,2,
"BBFFG1989045",6,"BFFG",1989045,"12/18/89 00:00:00",1989,12,18,"BBHOL5",55.09,55.15,16.36,16.6,58,"MYTI EDU","B",43,"220",2,,36.82,15.2,4,6,
"BBFFG1989046",6,"BFFG",1989046,"12/15/89 00:00:00",1989,12,15,"28,29",55.48,55.79,16.52,16.87,43.5,"MYTI EDU","B",43,"136",2,,41.3,16.7,4,6,
"BBFFG1989047",6,"BFFG",1989047,"12/19/89 00:00:00",1989,12,19,"BBHOL3",54.35,54.58,15.18,15.31,56.8,"MYTI EDU","B",41,,0,,43.58,17.4,6,6,
"BBFFG1989048",6,"BFFG",1989048,"12/13/89 00:00:00",1989,12,13,"BARC2",55.01,55.02,13.36,13.6,49.8,"PLEU PLA","F",5,,37,662,18.5,94.5,2,2,
"BBFFG1989049",6,"BFFG",1989049,"12/19/89 00:00:00",1989,12,19,"BBHOL3",54.33,54.55,15.2,15.33,50.6,"PLEU PLA","F",5,,0,,17.93,93.90000000000001,6,6,
"BBFFG1989050",6,"BFFG",1989050,"12/19/89 00:00:00",1989,12,19,"BBHOL3",54.33,54.55,15.2,15.33,50.6,"ENCH CIM","B",1,,0,,19.84,84.40000000000001,6,6,
"BBFFG1989051",6,"BFFG",1989051,"12/12/89 00:00:00",1989,12,12,"BKIBU1",54.36,54.59,10.21,10.35,19,"ASTE RUB","B",41,,0,,21.86,57.8,5,15,
"BBFFG1989052",6,"BFFG",1989052,"12/13/89 00:00:00",1989,12,13,"BARC2",55.01,55.02,13.36,13.6,49.8,"SPRA SPR","F",1,,12,17.9,35.47,94.2,2,2,
"BBFFG1989053",6,"BFFG",1989053,"12/18/89 00:00:00",1989,12,18,"BBHOL5",55.11,55.18,16.3,16.51,54.5,"SPRA SPR","F",1,,12,17,37.01,94.3,4,6,
"BBFFG1989054",6,"BFFG",1989054,"12/12/89 00:00:00",1989,12,12,"BKIBU1",54.36,54.6,10.17,10.28,19,"PSET MAX","F",5,,42,1526.6,26.22,95.90000000000001,5,15,
"BBFFG1990001",6,"BFFG",1990001,"12/12/90 00:00:00",1990,12,12,"BKIBU1",54.36,54.61,10.17,10.28,20,"GADU MOR","F",5,"14",60,3928,19.31,93.09999999999999,5,15,
"BBFFG1990002",6,"BFFG",1990002,"12/13/90 00:00:00",1990,12,13,"BARC2",54.57,54.94,13.4,13.66,57,"GADU MOR","F",5,"27",41,814.8,20.16,93.40000000000001,2,2,
"BBFFG1990003",6,"BFFG",1990003,"12/13/90 00:00:00",1990,12,13,"BARC2",54.57,54.96,13.44,13.73,56,"GADU MOR","F",5,"19",49,1578.9,20.12,93.3,2,2,
"BBFFG1990004",6,"BFFG",1990004,"12/14/90 00:00:00",1990,12,14,"BBHOL3",54.39,54.65,15.18,15.3,65,"GADU MOR","F",5,"21",51,1952,20.49,93.3,6,6,
"BBFFG1990005",6,"BFFG",1990005,"12/17/90 00:00:00",1990,12,17,"BBHOL5",55.1,55.17,16.27,16.44,60,"GADU MOR","F",5,"20",47,1320,20.66,93.3,4,6,
"BBFFG1990006",6,"BFFG",1990006,"12/16/90 00:00:00",1990,12,16,"26",55.48,55.8,16.46,16.77,45.5,"GADU MOR","F",5,"20",38,765,20.2,93.8,4,6,
"BBFFG1990007",6,"BFFG",1990007,"12/15/90 00:00:00",1990,12,15,"BROZE9",55.07,55.11,18.14,18.23,70.5,"GADU MOR","F",5,"13",54,2307,20.66,93.40000000000001,4,9,
"BBFFG1990008",6,"BFFG",1990008,"12/13/90 00:00:00",1990,12,13,"BARC2",54.47,54.79,14.01,14.02,42.5,"GADU MOR","F",5,"20",51,1800,21.14,93.5,2,2,
"BBFFG1990009",6,"BFFG",1990009,"12/12/90 00:00:00",1990,12,12,"BKIBU1",54.36,54.61,10.17,10.28,20,"GADU MOR","F",18,"14",60,3928,69.44,99.09999999999999,5,15,
"BBFFG1990010",6,"BFFG",1990010,"12/13/90 00:00:00",1990,12,13,"BARC2",54.57,54.96,13.44,13.73,56,"GADU MOR","F",18,"19",49,1578.9,78.12,98.90000000000001,2,2,
"BBFFG1990011",6,"BFFG",1990011,"12/13/90 00:00:00",1990,12,13,"BARC2",54.57,54.94,13.4,13.66,57,"GADU MOR","F",18,"27",41,814.8,76.34,99.40000000000001,2,2,
"BBFFG1990012",6,"BFFG",1990012,"12/14/90 00:00:00",1990,12,14,"BBHOL3",54.39,54.65,15.18,15.3,65,"GADU MOR","F",18,"21",51,1952,74.63,99.3,6,6,
"BBFFG1990013",6,"BFFG",1990013,"12/17/90 00:00:00",1990,12,17,"BBHOL5",55.1,55.17,16.27,16.44,60,"GADU MOR","F",18,"20",47,1320,75.19,99.40000000000001,4,6,
"BBFFG1990014",6,"BFFG",1990014,"12/16/90 00:00:00",1990,12,16,"26",55.48,55.8,16.46,16.77,45.5,"GADU MOR","F",18,"20",38,765,75.19,99.40000000000001,4,6,
"BBFFG1990015",6,"BFFG",1990015,"12/15/90 00:00:00",1990,12,15,"BROZE9",55.07,55.11,18.14,18.23,70.5,"GADU MOR","F",18,"13",54,2307,77.52,99.40000000000001,4,9,
"BBFFG1990016",6,"BFFG",1990016,"12/13/90 00:00:00",1990,12,13,"BARC2",54.47,54.79,14.01,14.02,42.5,"GADU MOR","F",18,"20",51,1800,79.37,99.5,2,2,
"BBFFG1990017",6,"BFFG",1990017,"12/13/90 00:00:00",1990,12,13,"BARC2",54.57,54.94,13.4,13.66,57,"PLAT FLE","F",5,"26",28,346.2,22.47,94.8,2,2,
"BBFFG1990018",6,"BFFG",1990018,"12/13/90 00:00:00",1990,12,13,"BARC2",55.03,55.05,13.4,13.66,50,"PLAT FLE","F",5,"33",29,393.9,23.64,94.90000000000001,2,2,
"BBFFG1990019",6,"BFFG",1990019,"12/13/90 00:00:00",1990,12,13,"BARC2",54.47,54.79,14.01,14.02,42.5,"PLAT FLE","F",5,"50",30,400,22.88,94.5,2,2,
"BBFFG1990020",6,"BFFG",1990020,"12/17/90 00:00:00",1990,12,17,"BBHOL5",55.1,55.17,16.27,16.44,60,"PLAT FLE","F",5,"16",33,456.2,20.33,93.90000000000001,4,6,
"BBFFG1990021",6,"BFFG",1990021,"12/15/90 00:00:00",1990,12,15,"BROZE9",55.05,55.09,18.14,18.24,70,"PLAT FLE","F",5,"16",30,562.5,25.38,95.40000000000001,4,9,
"BBFFG1990022",6,"BFFG",1990022,"12/12/90 00:00:00",1990,12,12,"BKIBU1",54.36,54.61,10.17,10.28,20,"CLUP HAR","F",5,"238",21,58.8,35.59,96,5,15,
"BBFFG1990023",6,"BFFG",1990023,"12/13/90 00:00:00",1990,12,13,"BARC2",54.57,54.96,13.44,13.73,56,"CLUP HAR","F",5,"107",23,84.09999999999999,34.13,95.90000000000001,2,2,
"BBFFG1990024",6,"BFFG",1990024,"12/14/90 00:00:00",1990,12,14,"BBHOL3",54.39,54.66,15.1,15.17,63,"CLUP HAR","F",5,"114",23,84,25.32,94.8,6,6,
"BBFFG1990025",6,"BFFG",1990025,"12/17/90 00:00:00",1990,12,17,"BBHOL5",55.1,55.17,16.27,16.44,60,"CLUP HAR","F",5,"162",23,88.8,25.51,94.40000000000001,4,6,
"BBFFG1990026",6,"BFFG",1990026,"12/16/90 00:00:00",1990,12,16,"26",55.48,55.8,16.46,16.77,45.5,"CLUP HAR","F",5,"102",22,78.40000000000001,25.64,94.5,4,6,
"BBFFG1990027",6,"BFFG",1990027,"12/15/90 00:00:00",1990,12,15,"BROZE9",55.07,55.11,18.14,18.23,70.5,"CLUP HAR","F",5,"119",24,142.8,24.27,93.8,4,9,
"BBFFG1990028",6,"BFFG",1990028,"12/13/90 00:00:00",1990,12,13,"BARC2",54.47,54.79,14.01,14.02,42.5,"CLUP HAR","F",5,"172",24,98.8,28.74,95,2,2,
"BBFFG1990029",6,"BFFG",1990029,"12/12/90 00:00:00",1990,12,12,"BKIBU1",54.35,54.59,10.17,10.28,21,"LIMA LIM","F",5,"74",27,229.7,21.55,93.8,5,15,
"BBFFG1990030",6,"BFFG",1990030,"12/12/90 00:00:00",1990,12,12,"BKIBU1",54.36,54.61,10.17,10.28,20,"LIMA LIM","F",5,"72",28,222.2,34.84,96.40000000000001,5,15,
"BBFFG1990031",6,"BFFG",1990031,"12/14/90 00:00:00",1990,12,14,"BBHOL3",54.37,54.62,15.16,15.27,62.5,"PLEU PLA","F",5,"33",27,303,18.76,93.90000000000001,6,6,
"BBFFG1990032",6,"BFFG",1990032,"12/12/90 00:00:00",1990,12,12,"BKIBU1",54.35,54.59,10.17,10.28,21,"MERL MNG","F",5,"185",20,64.8,21.79,89.59999999999999,5,15,
"BBFFG1990033",6,"BFFG",1990033,"12/13/90 00:00:00",1990,12,13,"BARC2",54.57,54.96,13.44,13.73,56,"MERL MNG","F",5,"41",34,439,22.03,94.09999999999999,2,2,
"BBFFG1990034",6,"BFFG",1990034,"12/13/90 00:00:00",1990,12,13,"BARC2",54.57,54.94,13.4,13.66,57,"SPRA SPR","F",1,"555",13,14.8,36.23,94.3,2,2,
"BBFFG1990035",6,"BFFG",1990035,"12/14/90 00:00:00",1990,12,14,"BBHOL3",54.39,54.66,15.1,15.17,63,"SPRA SPR","F",1,"724",13,12.8,33.44,93.59999999999999,6,6,
"BBFFG1990036",6,"BFFG",1990036,"12/13/90 00:00:00",1990,12,13,"BARC2",54.47,54.79,14.01,14.02,42.5,"SPRA SPR","F",1,"1058",10,11.8,32.26,93.2,2,2,
"BBFFG1990037",6,"BFFG",1990037,"12/13/90 00:00:00",1990,12,13,"BARC2",54.47,54.79,14.01,14.02,42.5,"MYTI EDU","B",41,,0,,43.48,11.5,2,2,
"BBFFG1990038",6,"BFFG",1990038,"12/15/90 00:00:00",1990,12,15,"BROZE9",55.05,55.09,18.14,18.24,70,"SADU ENT","B",41,,0,,16.5,57.1,4,9,
"BBFFG1990039",6,"BFFG",1990039,"12/12/90 00:00:00",1990,12,12,"BKIBU1",54.36,54.61,10.17,10.28,20,"ASTE RUB","B",41,,0,,25.58,56.1,5,15,
"BBFFG1990040",6,"BFFG",1990040,"12/12/90 00:00:00",1990,12,12,"BKIBU1",54.36,54.61,10.17,10.28,20,"FUCU VES","P",51,,0,,15.48,76.59999999999999,5,15,
"BBFFG1991001",6,"BFFG",1991001,"12/10/91 00:00:00",1991,12,10,"BKIBU1",54.38,54.64,10.25,10.42,21,"GADU MOR","F",5,"7",58,1857,20.49,93.2,5,15,
"BBFFG1991002",6,"BFFG",1991002,"12/10/91 00:00:00",1991,12,10,"BKIBU1",54.39,54.65,10.3,10.49,21.5,"GADU MOR","F",5,"5",77,5400,18.73,93,5,15,
"BBFFG1991003",6,"BFFG",1991003,"12/11/91 00:00:00",1991,12,11,"BARC2",54.59,54.99,13.36,13.61,52.5,"GADU MOR","F",5,"10",51,1400,20.45,93.2,2,2,
"BBFFG1991004",6,"BFFG",1991004,"12/11/91 00:00:00",1991,12,11,"BARC2",54.57,54.95,13.49,13.82,54.5,"GADU MOR","F",5,"12",47,1167,21.83,93.3,2,2,
"BBFFG1991005",6,"BFFG",1991005,"12/12/91 00:00:00",1991,12,12,"BBHOL3",54.37,54.61,14.59,14.98,51.5,"GADU MOR","F",5,"14",42,1000,21.93,93.59999999999999,6,6,
"BBFFG1991006",6,"BFFG",1991006,"12/12/91 00:00:00",1991,12,12,"BBHOL3",54.32,54.53,15.14,15.23,38,"GADU MOR","F",5,"12",48,1083,21.32,93.5,6,6,
"BBFFG1991007",6,"BFFG",1991007,"12/13/91 00:00:00",1991,12,13,"16",56.13,56.22,18.07,18.12,42,"GADU MOR","F",5,"7",51,1570,21.1,93.5,4,10,
"BBFFG1991008",6,"BFFG",1991008,"12/13/91 00:00:00",1991,12,13,"19",56.18,56.3,18.29,18.48,64.5,"GADU MOR","F",5,"10",52,1700,22.03,93.8,4,9,
"BBFFG1991009",6,"BFFG",1991009,"12/14/91 00:00:00",1991,12,14,"BROZE9",55.06,55.11,18.18,18.3,74.5,"GADU MOR","F",5,"8",59,2375,20.53,93.59999999999999,4,9,
"BBFFG1991010",6,"BFFG",1991010,"12/14/91 00:00:00",1991,12,14,"BROZE9",55.07,55.12,18.25,18.42,79.5,"GADU MOR","F",5,"5",60,6000,21.28,93.59999999999999,4,9,
"BBFFG1991011",6,"BFFG",1991011,"12/15/91 00:00:00",1991,12,15,"BBHOL5",55.11,55.19,16.28,16.46,59.5,"GADU MOR","F",5,"8",59,2750,22.94,94,4,6,
"BBFFG1991012",6,"BFFG",1991012,"12/15/91 00:00:00",1991,12,15,"BBHOL5",55.03,55.06,16.33,16.55,42,"GADU MOR","F",5,"1",110,14000,19.61,93.7,4,6,
"BBFFG1991013",6,"BFFG",1991013,"12/15/91 00:00:00",1991,12,15,"BBHOL5",55.05,55.08,16.3,16.5,51.5,"GADU MOR","F",5,"10",47,1200,21.1,93.40000000000001,4,6,
"BBFFG1991014",6,"BFFG",1991014,"12/16/91 00:00:00",1991,12,16,"BBHOL4",55.4,55.66,15.14,15.23,75,"GADU MOR","F",5,"9",45,1111,20.7,93.59999999999999,6,6,
"BBFFG1991015",6,"BFFG",1991015,"12/16/91 00:00:00",1991,12,16,"BBHOL4",55.42,55.7,15.09,15.16,71,"GADU MOR","F",5,"12",51,1416.7,22.83,93.7,6,6,
"BBFFG1991016",6,"BFFG",1991016,"12/17/91 00:00:00",1991,12,17,"BARC2",54.45,54.75,14.01,14.02,35.5,"GADU MOR","F",5,"1",102,12500,22.88,94.2,2,2,
"BBFFG1991017",6,"BFFG",1991017,"12/17/91 00:00:00",1991,12,17,"BARC2",54.45,54.75,14.01,14.02,35.5,"GADU MOR","F",5,"3",66,2833.3,22.88,94.5,2,2,
"BBFFG1991018",6,"BFFG",1991018,"12/17/91 00:00:00",1991,12,17,"43",54.47,54.78,13.09,13.15,33,"GADU MOR","F",5,"8",52,12500,21.65,93.7,2,2,
"BBFFG1991019",6,"BFFG",1991019,"12/18/91 00:00:00",1991,12,18,"BMEB12",54.18,54.3,11.46,11.77,24.5,"GADU MOR","F",5,"2",66,3500,21.69,93.59999999999999,5,16,
"BBFFG1991020",6,"BFFG",1991020,"12/18/91 00:00:00",1991,12,18,"BMEB12",54.16,54.27,11.44,11.74,26,"GADU MOR","F",5,"5",50,,22.12,93.40000000000001,5,16,
"BBFFG1991021",6,"BFFG",1991021,"12/10/91 00:00:00",1991,12,10,"BKIBU1",54.38,54.64,10.25,10.42,21,"GADU MOR","F",18,"7",58,1857,73.53,99.3,5,15,
"BBFFG1991022",6,"BFFG",1991022,"12/10/91 00:00:00",1991,12,10,"BKIBU1",54.39,54.65,10.3,10.49,21.5,"GADU MOR","F",18,"5",77,5400,66.67,98.8,5,15,
"BBFFG1991023",6,"BFFG",1991023,"12/11/91 00:00:00",1991,12,11,"BARC2",54.59,54.99,13.36,13.61,52.5,"GADU MOR","F",18,"10",51,1400,78.73999999999999,99.40000000000001,2,2,
"BBFFG1991024",6,"BFFG",1991024,"12/11/91 00:00:00",1991,12,11,"BARC2",54.57,54.95,13.49,13.82,54.5,"GADU MOR","F",18,"12",47,1167,81.3,99.5,2,2,
"BBFFG1991025",6,"BFFG",1991025,"12/12/91 00:00:00",1991,12,12,"BBHOL3",54.37,54.61,14.59,14.98,51.5,"GADU MOR","F",18,"14",42,1000,79.37,99.5,6,6,
"BBFFG1991026",6,"BFFG",1991026,"12/12/91 00:00:00",1991,12,12,"BBHOL3",54.32,54.53,15.14,15.23,38,"GADU MOR","F",18,"12",48,1083,80,99.40000000000001,6,6,
"BBFFG1991027",6,"BFFG",1991027,"12/13/91 00:00:00",1991,12,13,"16",56.13,56.22,18.07,18.12,42,"GADU MOR","F",18,"7",51,1570,81.3,99.5,4,10,
"BBFFG1991028",6,"BFFG",1991028,"12/13/91 00:00:00",1991,12,13,"19",56.18,56.3,18.29,18.48,64.5,"GADU MOR","F",18,"10",52,1700,81.3,99.5,4,9,
"BBFFG1991029",6,"BFFG",1991029,"12/14/91 00:00:00",1991,12,14,"BROZE9",55.06,55.11,18.18,18.3,74.5,"GADU MOR","F",18,"8",59,2375,78.73999999999999,99.5,4,9,
"BBFFG1991030",6,"BFFG",1991030,"12/14/91 00:00:00",1991,12,14,"BROZE9",55.07,55.12,18.25,18.42,79.5,"GADU MOR","F",18,"5",60,6000,74.06999999999999,99.3,4,9,
"BBFFG1991031",6,"BFFG",1991031,"12/15/91 00:00:00",1991,12,15,"BBHOL5",55.11,55.19,16.28,16.46,59.5,"GADU MOR","F",18,"8",59,2750,96.15000000000001,99.59999999999999,4,6,
"BBFFG1991032",6,"BFFG",1991032,"12/15/91 00:00:00",1991,12,15,"BBHOL5",55.03,55.06,16.33,16.55,42,"GADU MOR","F",18,"1",110,14000,76.92,99.2,4,6,
"BBFFG1991033",6,"BFFG",1991033,"12/15/91 00:00:00",1991,12,15,"BBHOL5",55.05,55.08,16.3,16.5,51.5,"GADU MOR","F",18,"10",47,1200,78.73999999999999,99.5,4,6,
"BBFFG1991034",6,"BFFG",1991034,"12/16/91 00:00:00",1991,12,16,"BBHOL4",55.4,55.66,15.14,15.23,75,"GADU MOR","F",18,"9",45,1111,78.73999999999999,99.5,6,6,
"BBFFG1991035",6,"BFFG",1991035,"12/16/91 00:00:00",1991,12,16,"BBHOL4",55.42,55.7,15.09,15.16,71,"GADU MOR","F",18,"12",51,1416.7,82.64,99.59999999999999,6,6,
"BBFFG1991036",6,"BFFG",1991036,"12/17/91 00:00:00",1991,12,17,"BARC2",54.45,54.75,14.01,14.02,35.5,"GADU MOR","F",18,"1",102,12500,77.52,99.5,2,2,
"BBFFG1991037",6,"BFFG",1991037,"12/17/91 00:00:00",1991,12,17,"BARC2",54.45,54.75,14.01,14.02,35.5,"GADU MOR","F",18,"3",66,2833.3,76.92,99.40000000000001,2,2,
"BBFFG1991038",6,"BFFG",1991038,"12/17/91 00:00:00",1991,12,17,"43",54.47,54.78,13.09,13.15,33,"GADU MOR","F",18,"8",52,12500,78.12,99.40000000000001,2,2,
"BBFFG1991039",6,"BFFG",1991039,"12/18/91 00:00:00",1991,12,18,"BMEB12",54.18,54.3,11.46,11.77,24.5,"GADU MOR","F",18,"2",66,3500,75.19,99.40000000000001,5,16,
"BBFFG1991040",6,"BFFG",1991040,"12/18/91 00:00:00",1991,12,18,"BMEB12",54.16,54.27,11.44,11.74,26,"GADU MOR","F",18,"5",50,,68.97,99.2,5,16,
"BBFFG1991041",6,"BFFG",1991041,"12/12/91 00:00:00",1991,12,12,"BBHOL3",54.37,54.61,14.59,14.98,51.5,"PLAT FLE","F",5,"18",34,550,22.17,94.2,6,6,
"BBFFG1991042",6,"BFFG",1991042,"12/14/91 00:00:00",1991,12,14,"BROZE9",55.07,55.12,18.25,18.42,79.5,"PLAT FLE","F",5,"17",30,435,25.19,95.09999999999999,4,9,
"BBFFG1991043",6,"BFFG",1991043,"12/17/91 00:00:00",1991,12,17,"40",54.4,54.66,14.17,14.28,30.5,"PLAT FLE","F",5,"17",29,359,21.74,94.40000000000001,2,2,
"BBFFG1991044",6,"BFFG",1991044,"12/13/91 00:00:00",1991,12,13,"18",56.2,56.33,18.23,18.39,42,"CLUP HAR","F",5,"54",24,113,32.89,95.90000000000001,4,9,
"BBFFG1991045",6,"BFFG",1991045,"12/15/91 00:00:00",1991,12,15,"BBHOL5",55.12,55.21,16.27,16.45,61,"CLUP HAR","F",5,"163",20,63.8,26.81,95,4,6,
"BBFFG1991046",6,"BFFG",1991046,"12/17/91 00:00:00",1991,12,17,"40",54.4,54.66,14.17,14.28,30.5,"CLUP HAR","F",5,"57",21,78.90000000000001,30.58,95.5,2,2,
"BBFFG1991047",6,"BFFG",1991047,"12/10/91 00:00:00",1991,12,10,"BKIBU1",54.37,54.62,10.22,10.37,19.3,"LIMA LIM","F",5,"36",27,258,33.56,96.09999999999999,5,15,
"BBFFG1991048",6,"BFFG",1991048,"12/11/91 00:00:00",1991,12,11,"BARC2",55,55,13.29,13.48,49,"MERL MNG","F",5,"20",35,502,27.78,95.2,2,2,
"BBFFG1991049",6,"BFFG",1991049,"12/18/91 00:00:00",1991,12,18,"BMEB12",54.18,54.3,11.46,11.77,24.5,"MERL MNG","F",5,"26",33,438,22.12,94,5,16,
"BBFFG1991050",6,"BFFG",1991050,"12/10/91 00:00:00",1991,12,10,"BKIBU1",54.38,54.63,10.25,10.41,20,"SPRA SPR","F",1,"216",13,20.8,33.22,93.2,5,15,
"BBFFG1991051",6,"BFFG",1991051,"12/11/91 00:00:00",1991,12,11,"BARC2",54.59,54.99,13.36,13.61,52.5,"SPRA SPR","F",1,"75",12,16,48.54,94.8,2,2,
"BBFFG1991052",6,"BFFG",1991052,"12/16/91 00:00:00",1991,12,16,"BBHOL4",55.36,55.59,15.12,15.2,80.5,"SPRA SPR","F",1,"60",12,15.3,48.08,95.59999999999999,6,6,
"BBFFG1991053",6,"BFFG",1991053,"12/18/91 00:00:00",1991,12,18,"BMEB12",54.15,54.25,11.47,11.78,23.5,"SPRA SPR","F",1,"59",13,18,44.84,95,5,16,
"BBFFG1991054",6,"BFFG",1991054,"05/28/91 00:00:00",1991,5,28,"BFFG ST07",54.04,54.07,11.28,11.47,7,"MYTI EDU","B",43,"436",3,,9.43,82.3,5,16,
"BBFFG1991055",6,"BFFG",1991055,"05/28/91 00:00:00",1991,5,28,"BFFG ST07",54.04,54.07,11.28,11.47,7,"MYTI EDU","B",41,"1800",3,,30.3,14.5,5,16,
"BBFFG1991056",6,"BFFG",1991056,"12/10/91 00:00:00",1991,12,10,"BKIBU1",54.37,54.61,10.33,10.55,19.3,"ARCT ISL","F",43,"24",6,,8.73,74.8,5,15,
"BBFFG1991057",6,"BFFG",1991057,"12/11/91 00:00:00",1991,12,11,"BARC2",55,55,13.33,13.54,50.8,"ARCT ISL","F",43,"50",5,,8.73,76.59999999999999,2,2,
"BBFFG1993001",6,"BFFG",1993001,"12/08/93 00:00:00",1993,12,8,"BKIBU1",54.4,54.66,10.31,10.51,20.5,"GADU MOR","F",5,"11",59,2363,19.34,93,5,15,
"BBFFG1993002",6,"BFFG",1993002,"12/07/93 00:00:00",1993,12,7,"BKIBU1",54.37,54.62,10.2,10.33,19.5,"GADU MOR","F",5,"14",50,1357,19.92,93.40000000000001,5,15,
"BBFFG1993003",6,"BFFG",1993003,"12/09/93 00:00:00",1993,12,9,"BARC2",55.02,55.04,13.3,13.49,48,"GADU MOR","F",5,"32",42,1205,19.53,93.40000000000001,2,2,
"BBFFG1993004",6,"BFFG",1993004,"12/12/93 00:00:00",1993,12,12,"BBHOL5",55.06,55.11,16.32,16.54,54.5,"GADU MOR","F",5,"10",55,2100,19.8,93.40000000000001,4,6,
"BBFFG1993005",6,"BFFG",1993005,"12/15/93 00:00:00",1993,12,15,"BFFG ST08",55.23,55.38,16.06,16.1,85.8,"GADU MOR","F",5,"15",57,1900,19.42,93.40000000000001,6,6,
"BBFFG1993006",6,"BFFG",1993006,"12/15/93 00:00:00",1993,12,15,"BBHOL5",55.02,55.04,15.59,15.99,80.5,"GADU MOR","F",5,"10",62,2450,30.3,95.8,6,6,
"BBFFG1993007",6,"BFFG",1993007,"12/12/93 00:00:00",1993,12,12,"BBHOL5",55.06,55.11,16.32,16.54,54.5,"GADU MOR","F",5,"1",107,9999.9,20.58,94.40000000000001,4,6,
"BBFFG1993008",6,"BFFG",1993008,"12/11/93 00:00:00",1993,12,11,"BBHOL3",54.38,54.64,15.21,15.35,64,"GADU MOR","F",5,"16",52,1594,20.41,93.8,6,6,
"BBFFG1993009",6,"BFFG",1993009,"12/10/93 00:00:00",1993,12,10,"BADG10",54.48,54.79,14.02,14.03,36,"GADU MOR","F",5,"17",50,1471,19.65,93.2,2,2,
"BBFFG1993010",6,"BFFG",1993010,"12/11/93 00:00:00",1993,12,11,"BBHOL3",54.38,54.64,15,15.01,55.5,"GADU MOR","F",5,"22",51,1477.9,22.03,94.5,6,6,
"BBFFG1993011",6,"BFFG",1993011,"12/10/93 00:00:00",1993,12,10,"BADG10",54.47,54.78,14.02,14.03,34,"GADU MOR","F",5,"12",57,2250.8,20.7,93.90000000000001,2,2,
"BBFFG1993012",6,"BFFG",1993012,"12/13/93 00:00:00",1993,12,13,"BROZE9",55.07,55.12,18.16,18.26,76,"GADU MOR","F",5,"14",56,1893,26.67,95.40000000000001,4,9,
"BBFFG1993013",6,"BFFG",1993013,"12/18/93 00:00:00",1993,12,18,"BMEB12",54.17,54.29,11.41,11.69,26.5,"GADU MOR","F",5,"12",57,2083,20.16,93.3,5,16,
"BBFFG1993014",6,"BFFG",1993014,"12/17/93 00:00:00",1993,12,17,"BARC2",54.45,54.76,13.15,13.25,37,"GADU MOR","F",5,"10",66,3250,20.08,93.59999999999999,2,2,
"BBFFG1993015",6,"BFFG",1993015,"12/16/93 00:00:00",1993,12,16,"BBHOL4",55.39,55.65,15.11,15.19,73.8,"GADU MOR","F",5,"19",54,1605,19.23,93.2,6,6,
"BBFFG1993016",6,"BFFG",1993016,"12/12/93 00:00:00",1993,12,12,"BBHOL5",55.14,55.23,16.4,16.67,73.5,"GADU MOR","F",5,"2",97,9250,18.87,93.59999999999999,4,6,
"BBFFG1993017",6,"BFFG",1993017,"12/13/93 00:00:00",1993,12,13,"BROZE9",55.14,55.23,18.14,18.23,65.5,"GADU MOR","F",5,"2",94,8500,16.29,92.90000000000001,4,9,
"BBFFG1993018",6,"BFFG",1993018,"12/14/93 00:00:00",1993,12,14,"BFFG ST01",55.39,55.66,18.09,18.14,73,"GADU MOR","F",5,"14",54,1964,18.73,93.2,4,9,
"BBFFG1993019",6,"BFFG",1993019,"12/07/93 00:00:00",1993,12,7,"BKIBU1",54.37,54.62,10.2,10.33,19.5,"GADU MOR","F",18,"14",50,1357,68.03,98.90000000000001,5,15,
"BBFFG1993020",6,"BFFG",1993020,"12/08/93 00:00:00",1993,12,8,"BKIBU1",54.4,54.66,10.31,10.51,20.5,"GADU MOR","F",18,"11",59,2363,68.03,99,5,15,
"BBFFG1993021",6,"BFFG",1993021,"12/09/93 00:00:00",1993,12,9,"BARC2",55.02,55.04,13.3,13.49,48,"GADU MOR","F",18,"24",44,1042,78.12,99.40000000000001,2,2,
"BBFFG1993022",6,"BFFG",1993022,"12/16/93 00:00:00",1993,12,16,"BBHOL4",55.39,55.65,15.11,15.19,73.8,"GADU MOR","F",18,"19",54,1605,78.73999999999999,99.3,6,6,
"BBFFG1993023",6,"BFFG",1993023,"12/12/93 00:00:00",1993,12,12,"BBHOL5",55.14,55.23,16.4,16.67,73.5,"GADU MOR","F",18,"2",97,9250,67.56999999999999,99.09999999999999,4,6,
"BBFFG1993024",6,"BFFG",1993024,"12/12/93 00:00:00",1993,12,12,"BBHOL5",55.06,55.11,16.32,16.54,54.5,"GADU MOR","F",18,"11",60,3091,76.92,99.3,4,6,
"BBFFG1993025",6,"BFFG",1993025,"12/14/93 00:00:00",1993,12,14,"BFFG ST01",55.39,55.66,18.09,18.14,73,"GADU MOR","F",18,"14",54,1964,76.34,99.40000000000001,4,9,
"BBFFG1993026",6,"BFFG",1993026,"12/10/93 00:00:00",1993,12,10,"BADG10",54.47,54.78,14.02,14.03,34,"GADU MOR","F",18,"12",57,2250,75.76000000000001,99.40000000000001,2,2,
"BBFFG1993027",6,"BFFG",1993027,"12/17/93 00:00:00",1993,12,17,"BARC2",54.45,54.76,13.15,13.25,36.8,"GADU MOR","F",18,"10",66,3250,71.43000000000001,98.90000000000001,2,2,
"BBFFG1993028",6,"BFFG",1993028,"12/11/93 00:00:00",1993,12,11,"BBHOL3",54.38,54.64,15,15.01,55.5,"GADU MOR","F",18,"22",51,1477,77.52,99.40000000000001,6,6,
"BBFFG1993029",6,"BFFG",1993029,"12/13/93 00:00:00",1993,12,13,"BROZE9",55.07,55.12,18.16,18.26,76,"GADU MOR","F",18,"14",56,1893,77.52,99.40000000000001,4,9,
"BBFFG1993030",6,"BFFG",1993030,"12/10/93 00:00:00",1993,12,10,"BADG10",54.48,54.79,14.02,14.03,36,"GADU MOR","F",18,"17",50,1471,76.34,99.3,2,2,
"BBFFG1993031",6,"BFFG",1993031,"12/11/93 00:00:00",1993,12,11,"BBHOL3",54.38,54.64,15.21,15.35,64,"GADU MOR","F",18,"16",52,1594,78.73999999999999,99.5,6,6,
"BBFFG1993032",6,"BFFG",1993032,"12/12/93 00:00:00",1993,12,12,"BROZE9",55.14,55.23,18.14,18.23,65.5,"GADU MOR","F",18,"2",94,8500,75.76000000000001,99.2,4,9,
"BBFFG1993033",6,"BFFG",1993033,"12/15/93 00:00:00",1993,12,15,"BBHOL5",55.02,55.04,15.59,15.99,80.5,"GADU MOR","F",18,"10",62,2450,76.92,99.2,6,6,
"BBFFG1993034",6,"BFFG",1993034,"12/15/93 00:00:00",1993,12,15,"BFFG ST08",55.23,55.38,16.06,16.1,85.8,"GADU MOR","F",18,"15",57,1900,78.73999999999999,99.2,6,6,
"BBFFG1993035",6,"BFFG",1993035,"12/18/93 00:00:00",1993,12,18,"BMEB12",54.17,54.29,11.41,11.69,26,"GADU MOR","F",18,"12",57,2083,71.43000000000001,98.8,5,16,
"BBFFG1993036",6,"BFFG",1993036,"12/12/93 00:00:00",1993,12,12,"BBHOL5",55.06,55.11,16.32,16.54,54.5,"GADU MOR","F",18,"1",107,9999.9,74.06999999999999,99.09999999999999,4,6,
"BBFFG1993037",6,"BFFG",1993037,"12/08/93 00:00:00",1993,12,8,"BKIBU1",54.38,54.64,10.25,10.42,20,"GADU MOR","F",18,"25",54,1800,68.03,99,5,15,
"BBFFG1993038",6,"BFFG",1993038,"12/11/93 00:00:00",1993,12,11,"BBHOL3",54.41,54.69,14.48,14.8,51.2,"GADU MOR","F",18,"50",53,1700,77.52,99.40000000000001,6,6,
"BBFFG1993039",6,"BFFG",1993039,"12/13/93 00:00:00",1993,12,13,"BROZE9",55.1,55.17,18.15,18.25,70.8,"GADU MOR","F",18,"16",60,2719,76.92,99.3,4,9,
"BBFFG1993040",6,"BFFG",1993040,"12/15/93 00:00:00",1993,12,15,"BBHOL5",55.16,55.26,16.04,16.06,84,"GADU MOR","F",18,"25",59,2120,78.12,99.2,6,6,
"BBFFG1993041",6,"BFFG",1993041,"12/12/93 00:00:00",1993,12,12,"BBHOL5",55.09,55.15,16.35,16.58,63.8,"GADU MOR","F",18,"14",68,4679,73.53,99.2,4,6,
"BBFFG1993042",6,"BFFG",1993042,"12/12/93 00:00:00",1993,12,12,"BBHOL5",55.06,55.1,16.34,16.56,53.3,"PLAT FLE","F",5,"42",35,667,21.69,90.5,4,6,
"BBFFG1993043",6,"BFFG",1993043,"12/09/93 00:00:00",1993,12,9,"BARC2",55.02,55.04,13.3,13.49,48,"PLAT FLE","F",5,,0,,41.49,96.90000000000001,2,2,
"BBFFG1993044",6,"BFFG",1993044,"12/17/93 00:00:00",1993,12,17,"BARC2",54.45,54.75,13.16,13.26,38.5,"PLAT FLE","F",5,"35",32,771,21.88,94.09999999999999,2,2,
"BBFFG1993045",6,"BFFG",1993045,"12/10/93 00:00:00",1993,12,10,"BADG10",54.48,54.79,14.02,14.03,36,"PLAT FLE","F",5,"36",36,639,21.79,94.2,2,2,
"BBFFG1993046",6,"BFFG",1993046,"12/11/93 00:00:00",1993,12,11,"BBHOL3",54.37,54.62,15.1,15.16,57,"PLAT FLE","F",5,"47",34,564,22.12,94.09999999999999,6,6,
"BBFFG1993047",6,"BFFG",1993047,"12/08/93 00:00:00",1993,12,8,"BARC2",55.02,55.04,13.44,13.73,48.5,"MERL MNG","F",5,"31",37,597,26.81,95.59999999999999,2,2,
"BBFFG1993048",6,"BFFG",1993048,"12/08/93 00:00:00",1993,12,8,"BKIBU1",54.33,54.55,10.46,10.77,24,"MERL MNG","F",5,"52",38,644,19.31,93,5,15,
"BBFFG1994001",6,"BFFG",1994001,"11/26/94 00:00:00",1994,11,26,"BMEB12",54.22,54.37,11.36,11.6,21.3,"GADU MOR","F",5,"14",48,1241,22.22,93.7,5,16,
"BBFFG1994002",6,"BFFG",1994002,"11/26/94 00:00:00",1994,11,26,"BMEB12",54.2,54.34,11.35,11.58,20.5,"GADU MOR","F",5,"23",38,648,22.03,93.5,5,16,
"BBFFG1994003",6,"BFFG",1994003,"12/07/94 00:00:00",1994,12,7,"BARC2",54.46,54.76,13.25,13.42,37,"GADU MOR","F",5,"12",48,1142,22.37,93.90000000000001,2,2,
"BBFFG1994004",6,"BFFG",1994004,"11/27/94 00:00:00",1994,11,27,"BBHOL3",54.38,54.64,15.14,15.24,52.8,"GADU MOR","F",5,"12",50,1298,19.61,93.59999999999999,6,6,
"BBFFG1994005",6,"BFFG",1994005,"11/28/94 00:00:00",1994,11,28,"B: S5",55.01,55.01,17.25,17.41,28.5,"GADU MOR","F",5,"15",45,1033,19.76,93.7,4,6,
"BBFFG1994006",6,"BFFG",1994006,"11/29/94 00:00:00",1994,11,29,"B: S7",54.3,54.5,18.52,18.86,32.5,"GADU MOR","F",5,"12",48,1250,20.7,93.59999999999999,4,4,
"BBFFG1994007",6,"BFFG",1994007,"12/06/94 00:00:00",1994,12,6,"B: S10",55.4,55.66,20.54,20.91,34,"GADU MOR","F",5,"9",44,,21.37,94,4,9,
"BBFFG1994008",6,"BFFG",1994008,"11/30/94 00:00:00",1994,11,30,"B: S11",56.34,56.57,20.34,20.56,49.5,"GADU MOR","F",5,"13",44,1046,21.88,94,9,9,
"BBFFG1994009",6,"BFFG",1994009,"12/05/94 00:00:00",1994,12,5,"B: S12",57.16,57.26,21.08,21.14,49.5,"GADU MOR","F",5,"3",59,,20.79,93.8,9,9,
"BBFFG1994010",6,"BFFG",1994010,"11/26/94 00:00:00",1994,11,26,"BMEB12",54.22,54.37,11.36,11.6,21.3,"GADU MOR","F",18,"14",48,1241,66.23,98.59999999999999,5,16,
"BBFFG1994011",6,"BFFG",1994011,"11/26/94 00:00:00",1994,11,26,"BMEB12",54.2,54.34,11.35,11.58,20.5,"GADU MOR","F",18,"23",38,648,65.79000000000001,98.7,5,16,
"BBFFG1994012",6,"BFFG",1994012,"12/07/94 00:00:00",1994,12,7,"BARC2",54.46,54.76,13.25,13.42,37,"GADU MOR","F",18,"12",48,1142,76.34,99.40000000000001,2,2,
"BBFFG1994013",6,"BFFG",1994013,"11/27/94 00:00:00",1994,11,27,"BBHOL3",54.38,54.64,15.14,15.24,52.8,"GADU MOR","F",18,"12",50,1298,78.73999999999999,99.3,6,6,
"BBFFG1994014",6,"BFFG",1994014,"11/28/94 00:00:00",1994,11,28,"B: S5",55.01,55.01,17.25,17.41,28.5,"GADU MOR","F",18,"15",45,1033,74.63,99.3,4,6,
"BBFFG1994015",6,"BFFG",1994015,"11/29/94 00:00:00",1994,11,29,"B: S7",54.3,54.5,18.52,18.86,32.5,"GADU MOR","F",18,"12",48,1250,80.65000000000001,99.40000000000001,4,4,
"BBFFG1994016",6,"BFFG",1994016,"12/06/94 00:00:00",1994,12,6,"B: S10",55.4,55.66,20.54,20.91,34,"GADU MOR","F",18,"9",44,,75.19,99.40000000000001,4,9,
"BBFFG1994017",6,"BFFG",1994017,"11/30/94 00:00:00",1994,11,30,"B: S11",56.34,56.57,20.34,20.56,49.5,"GADU MOR","F",18,"13",44,1046,79.37,99.5,9,9,
"BBFFG1994018",6,"BFFG",1994018,"12/05/94 00:00:00",1994,12,5,"B: S12",57.16,57.26,21.08,21.14,49.5,"GADU MOR","F",18,"3",59,,78.73999999999999,99.5,9,9,
"BBFFG1994019",6,"BFFG",1994019,"11/27/94 00:00:00",1994,11,27,"BBHOL3",54.29,54.48,15.15,15.25,35,"PLAT FLE","F",5,"31",27,460,22.57,94.59999999999999,6,6,
"BBFFG1994020",6,"BFFG",1994020,"11/28/94 00:00:00",1994,11,28,"B: S5",55,54.99,17.36,17.61,33,"PLAT FLE","F",5,"29",33,552,29.07,95.8,4,9,
"BBFFG1994021",6,"BFFG",1994021,"11/30/94 00:00:00",1994,11,30,"B: S11",56.34,56.57,20.34,20.56,49.5,"PLAT FLE","F",5,"25",31,496,25.25,95.3,9,9,
"BBFFG1994022",6,"BFFG",1994022,"12/04/94 00:00:00",1994,12,4,"B: S16",59.35,59.59,24.13,24.22,85,"CLUP HAR","F",5,"277",16,27,22.42,93.8,11,11,
"BBFFG1994023",6,"BFFG",1994023,"10/09/94 00:00:00",1994,10,9,"BIKUB1",54.34,54.56,10.07,10.11,27,"CLUP HAR","F",1,"281",11,13.5,28.74,91.2,5,15,
"BBFFG1994024",6,"BFFG",1994024,"10/10/94 00:00:00",1994,10,10,"BKIBU1",54.41,54.68,10.28,10.46,31,"CLUP HAR","F",1,"154",12,14.9,26.95,90.59999999999999,5,15,
"BBFFG1994025",6,"BFFG",1994025,"11/27/94 00:00:00",1994,11,27,"BBHOL3",54.38,54.64,15.14,15.24,52.8,"PLEU PLA","F",5,"21",25,214,21.51,94.7,6,6,
"BBFFG1994026",6,"BFFG",1994026,"11/26/94 00:00:00",1994,11,26,"BMEB12",54.2,54.34,11.3,11.5,20,"SPRA SPR","F",1,"763",10,8.800000000000001,35.09,94.3,5,16,
"BBFFG1994027",6,"BFFG",1994027,"11/26/94 00:00:00",1994,11,26,"BMEB12",54.2,54.33,11.36,11.6,22.5,"MERL MNG","F",5,"36",33,406,31.35,95.7,5,16,
"BBFFG1995001",6,"BFFG",1995001,"12/13/95 00:00:00",1995,12,13,"BROZE9",55.12,55.19,18.15,18.25,62.8,"GADU MOR","F",5,"5",90,7140,21.1,94.3,4,9,
"BBFFG1995002",6,"BFFG",1995002,"12/13/95 00:00:00",1995,12,13,"BROZE9",55.13,55.21,18.11,18.18,59,"GADU MOR","F",5,"16",54,1603,20.41,93.8,4,9,
"BBFFG1995003",6,"BFFG",1995003,"12/16/95 00:00:00",1995,12,16,"BARC2",54.47,54.78,13.16,13.26,40,"GADU MOR","F",5,"13",56,1866,22.42,94.40000000000001,2,2,
"BBFFG1995004",6,"BFFG",1995004,"12/14/95 00:00:00",1995,12,14,"BBHOL5",55.05,55.08,16.3,16.51,45.5,"GADU MOR","F",5,"19",48,1247,22.32,94.2,4,6,
"BBFFG1995005",6,"BFFG",1995005,"12/15/95 00:00:00",1995,12,15,"BBHOL3",54.37,54.62,15.12,15.2,52.5,"GADU MOR","F",5,"17",49,1306,26.32,95.09999999999999,6,6,
"BBFFG1995006",6,"BFFG",1995006,"12/14/95 00:00:00",1995,12,14,"BBHOL5",55.13,55.21,16.36,16.61,61,"GADU MOR","F",5,"20",49,1177,22.62,94.2,4,6,
"BBFFG1995007",6,"BFFG",1995007,"12/11/95 00:00:00",1995,12,11,"BBHOL4",55.41,55.69,15.05,15.09,59.5,"GADU MOR","F",5,,0,,18.76,93.40000000000001,6,6,
"BBFFG1995008",6,"BFFG",1995008,"12/12/95 00:00:00",1995,12,12,"BFFG ST04",55.47,55.78,16.41,16.69,46,"GADU MOR","F",5,"17",48,1200,20.88,93.7,4,6,
"BBFFG1995009",6,"BFFG",1995009,"12/17/95 00:00:00",1995,12,17,"BMEB12",54.18,54.3,11.42,11.69,26,"GADU MOR","F",5,"28",41,775,20.24,93.5,5,16,
"BBFFG1995010",6,"BFFG",1995010,"12/17/95 00:00:00",1995,12,17,"BMEB12",54.18,54.3,11.42,11.69,26,"GADU MOR","F",5,"12",51,1558,20.66,93.59999999999999,5,16,
"BBFFG1995011",6,"BFFG",1995011,"12/18/95 00:00:00",1995,12,18,"BKIBU1",54.33,54.55,10.45,10.75,24,"GADU MOR","F",5,"17",52,1503,21.05,93.09999999999999,5,15,
"BBFFG1995012",6,"BFFG",1995012,"12/09/95 00:00:00",1995,12,9,"BARC2",55.02,55.04,13.29,13.48,40.5,"GADU MOR","F",5,"20",47,1095,21.23,93.09999999999999,2,2,
"BBFFG1995013",6,"BFFG",1995013,"12/10/95 00:00:00",1995,12,10,"BARC2",54.47,54.79,13.59,13.98,33,"GADU MOR","F",5,"40",42,768,28.65,94.8,2,2,
"BBFFG1995014",6,"BFFG",1995014,"12/10/95 00:00:00",1995,12,10,"BARC2",54.48,54.8,14,14.01,33.3,"GADU MOR","F",5,"40",52,1425,22.68,93.8,2,2,
"BBFFG1995015",6,"BFFG",1995015,"12/15/95 00:00:00",1995,12,15,"BBHOL3",54.38,54.63,15.16,15.26,55,"PLAT FLE","F",5,"29",34,610,23.42,94.90000000000001,6,6,
"BBFFG1995016",6,"BFFG",1995016,"12/10/95 00:00:00",1995,12,10,"BARC2",54.47,54.79,13.59,13.98,33,"PLAT FLE","F",5,,0,,22.78,93.59999999999999,2,2,
"BBFFG1995017",6,"BFFG",1995017,"12/09/95 00:00:00",1995,12,9,"BARC2",55.02,55.04,13.36,13.6,41.3,"PLAT FLE","F",5,,0,,23.31,95.2,2,2,
"BBFFG1995018",6,"BFFG",1995018,"12/12/95 00:00:00",1995,12,12,"BFFG ST04",55.43,55.71,16.44,16.74,46.5,"CLUP HAR","F",5,"235",19,67,25.51,94.40000000000001,4,6,
"BBFFG1995019",6,"BFFG",1995019,"12/14/95 00:00:00",1995,12,14,"BBHOL5",55.07,55.11,16.29,16.48,49.3,"CLUP HAR","F",5,"99",20,73,25.38,94.3,4,6,
"BBFFG1995020",6,"BFFG",1995020,"12/15/95 00:00:00",1995,12,15,"BBHOL3",54.33,54.54,14.59,14.99,38.3,"CLUP HAR","F",5,"103",22,119,32.68,95.8,6,6,
"BBFFG1995021",6,"BFFG",1995021,"12/16/95 00:00:00",1995,12,16,"BARC2",54.48,54.8,13.18,13.3,44,"CLUP HAR","F",5,"128",23,125,32.36,95.90000000000001,2,2,
"BBFFG1995022",6,"BFFG",1995022,"12/18/95 00:00:00",1995,12,18,"BKIBU1",54.32,54.54,10.41,10.69,22.3,"PLEU PLA","F",5,"16",28,285,20.49,94,5,15,
"BBFFG1995023",6,"BFFG",1995023,"12/15/95 00:00:00",1995,12,15,"BBHOL3",54.36,54.6,15.09,15.14,48.6,"PLEU PLA","F",5,"22",33,499,19.65,94.90000000000001,6,6,
"BBFFG1995024",6,"BFFG",1995024,"12/09/95 00:00:00",1995,12,9,"BARC2",55.02,55.04,13.29,13.48,40.5,"PLEU PLA","F",5,"26",36,663,20.08,94.90000000000001,2,2,
"BBFFG1995025",6,"BFFG",1995025,"12/15/95 00:00:00",1995,12,15,"BBHOL3",54.32,54.54,14.59,14.99,37,"SPRA SPR","F",1,"476",13,18.1,27.32,91.09999999999999,6,6,
"BBFFG1995026",6,"BFFG",1995026,"12/17/95 00:00:00",1995,12,17,"BMEB12",54.15,54.24,11.4,11.67,25.5,"SPRA SPR","F",1,"440",13,18.2,31.45,92.90000000000001,5,16,
"BBFFG1995027",6,"BFFG",1995027,"12/09/95 00:00:00",1995,12,9,"BARC2",55.02,55.04,13.46,13.77,42,"SPRA SPR","F",1,"1034",11,12.7,37.31,93.90000000000001,2,2,
"BBFFG1995028",6,"BFFG",1995028,"12/12/95 00:00:00",1995,12,12,"BFFG ST04",55.43,55.72,16.45,16.75,44.5,"SPRA SPR","F",1,"684",11,13,32.05,93.40000000000001,4,6,
"BBFFG1995029",6,"BFFG",1995029,"12/11/95 00:00:00",1995,12,11,"BBHOL4",55.41,55.69,15.05,15.09,59.5,"SPRA SPR","F",1,"594",12,15.3,32.89,93.59999999999999,6,6,
"BBFFG1995030",6,"BFFG",1995030,"12/10/95 00:00:00",1995,12,10,"BARC2",54.48,54.81,14.02,14.03,33.5,"SPRA SPR","F",1,"1643",9,7.5,31.35,93.2,2,2,
"BBFFG1995031",6,"BFFG",1995031,"12/16/95 00:00:00",1995,12,16,"BARC2",54.47,54.78,13.16,13.26,40,"GADU MOR","F",18,"13",56,1866,72.98999999999999,99,2,2,
"BBFFG1995032",6,"BFFG",1995032,"12/15/95 00:00:00",1995,12,15,"BBHOL3",54.37,54.62,15.12,15.2,52.5,"GADU MOR","F",18,"17",49,1306,75.76000000000001,99.40000000000001,6,6,
"BBFFG1995033",6,"BFFG",1995033,"12/10/95 00:00:00",1995,12,10,"BARC2",54.48,54.8,14,14.01,33.3,"GADU MOR","F",18,"40",52,1425,87.72,99.5,2,2,
"BBFFG1995034",6,"BFFG",1995034,"12/10/95 00:00:00",1995,12,10,"BARC2",54.47,54.79,13.59,13.98,33,"GADU MOR","F",18,"40",42,768,75.19,99.3,2,2,
"BBFFG1995035",6,"BFFG",1995035,"12/12/95 00:00:00",1995,12,12,"BFFG ST03",55.47,55.78,16.41,16.69,46,"GADU MOR","F",18,"17",48,1200,77.52,98.8,4,6,
"BBFFG1995036",6,"BFFG",1995036,"12/13/95 00:00:00",1995,12,13,"BROZE9",55.12,55.19,18.15,18.25,62.8,"GADU MOR","F",18,"5",90,7140,77.52,99,4,9,
"BBFFG1995037",6,"BFFG",1995037,"12/13/95 00:00:00",1995,12,13,"BROZE9",55.13,55.21,18.11,18.18,59,"GADU MOR","F",18,"16",54,1603,77.52,99.2,4,9,
"BBFFG1995038",6,"BFFG",1995038,"12/14/95 00:00:00",1995,12,14,"BBHOL5",55.13,55.21,16.36,16.61,61,"GADU MOR","F",18,"20",49,1177,78.12,99.40000000000001,4,6,
"BBFFG1995039",6,"BFFG",1995039,"12/14/95 00:00:00",1995,12,14,"BBHOL5",55.05,55.08,16.3,16.51,45.5,"GADU MOR","F",18,"19",48,1247,76.92,99.2,4,6,
"BBFFG1995040",6,"BFFG",1995040,"12/09/95 00:00:00",1995,12,9,"BARC2",55.02,55.04,13.29,13.48,40.5,"GADU MOR","F",18,"20",47,1095,78.73999999999999,99.40000000000001,2,2,
"BBFFG1995041",6,"BFFG",1995041,"12/11/95 00:00:00",1995,12,11,"BBHOL4",55.41,55.69,15.05,15.09,59.5,"GADU MOR","F",18,,0,,75.76000000000001,99,6,6,
"BBFFG1995042",6,"BFFG",1995042,"12/17/95 00:00:00",1995,12,17,"BMEB12",54.18,54.3,11.42,11.69,26,"GADU MOR","F",18,"28",41,775,72.98999999999999,98.7,5,16,
"BBFFG1995043",6,"BFFG",1995043,"12/17/95 00:00:00",1995,12,17,"BMEB12",54.18,54.3,11.42,11.69,26,"GADU MOR","F",18,"12",51,1558,74.63,99,5,16,
"BBFFG1995044",6,"BFFG",1995044,"12/18/95 00:00:00",1995,12,18,"BKIBU1",54.33,54.55,10.45,10.75,24,"GADU MOR","F",18,"17",52,1503,70.92,98.90000000000001,5,15,
"BBFFG1995045",6,"BFFG",1995045,"10/10/95 00:00:00",1995,10,10,"BGBODD",54.13,54.22,13.43,13.72,0,"FUCU VES","P",51,,0,,21.98,79.59999999999999,2,2,
"BBFFG1995046",6,"BFFG",1995046,"11/07/95 00:00:00",1995,11,7,"BGBODD",54.13,54.22,13.43,13.72,0,"FUCU VES","P",51,,0,,22.68,79.59999999999999,2,2,
"BBFFG1995047",6,"BFFG",1995047,"09/25/95 00:00:00",1995,9,25,"BPOEL",54.05,54.08,11.3,11.5,0,"FUCU VES","P",51,,0,,34.48,86,5,16,
"BBFFG1995048",6,"BFFG",1995048,"11/06/95 00:00:00",1995,11,6,"BPOEL",54.05,54.08,11.3,11.5,0,"FUCU VES","P",51,,0,,17.95,57.6,5,16,
"BBFFG1995049",6,"BFFG",1995049,"10/10/95 00:00:00",1995,10,10,"BGBODD",54.13,54.22,13.43,13.72,0,"MYTI EDU","B",41,,2,0.9,31.75,18.7,2,2,
"BBFFG1995050",6,"BFFG",1995050,"11/07/95 00:00:00",1995,11,7,"BGBODD",54.13,54.22,13.43,13.72,0,"MYTI EDU","B",41,,2,1,34.13,16,2,2,
"BBFFG1995051",6,"BFFG",1995051,"11/07/95 00:00:00",1995,11,7,"BGBODD",54.13,54.22,13.43,13.72,0,"MYTI EDU","B",41,,0,,32.26,16.7,2,2,
"BBFFG1995052",6,"BFFG",1995052,"09/21/95 00:00:00",1995,9,21,"BPOEL",54.05,54.08,11.3,11.5,0,"MYTI EDU","B",41,,0,,31.85,20,5,16,
"BBFFG1995053",6,"BFFG",1995053,"09/21/95 00:00:00",1995,9,21,"BPOEL",54.05,54.08,11.3,11.5,0,"MYTI EDU","B",41,,0,,42.37,12.3,5,16,
"BBFFG1995054",6,"BFFG",1995054,"09/21/95 00:00:00",1995,9,21,"BPOEL",54.05,54.08,11.3,11.5,0,"MYTI EDU","B",41,,0,,23.04,13.8,5,16,
"BBFFG1995055",6,"BFFG",1995055,"10/10/95 00:00:00",1995,10,10,"BPOEL",54.05,54.08,11.3,11.5,0,"MYTI EDU","B",41,,0,,31.06,14.5,5,16,
"BBFFG1995056",6,"BFFG",1995056,"10/10/95 00:00:00",1995,10,10,"BPOEL",54.05,54.08,11.3,11.5,0,"MYTI EDU","B",41,,0,,33.22,14.5,5,16,
"BBFFG1996001",6,"BFFG",1996001,"12/08/96 00:00:00",1996,12,8,"BKIBU1",54.34,54.56,10.44,10.73,22.8,"RHODOPHY","P",51,,0,,16.98,50.5,5,15,
"BBFFG1996002",6,"BFFG",1996002,"12/14/96 00:00:00",1996,12,14,"BFFG ST05",56.17,56.29,18.17,18.29,41.8,"CLUP HAR","F",5,"166",20,69,21.6,92.5,4,9,
"BBFFG1996003",6,"BFFG",1996003,"12/16/96 00:00:00",1996,12,16,"BFFG ST04",55.4,55.67,16.44,16.73,50,"CLUP HAR","F",5,"143",21,69,23.15,93.3,4,6,
"BBFFG1996004",6,"BFFG",1996004,"12/10/96 00:00:00",1996,12,10,"BARC2",55.02,55.04,13.32,13.53,47,"CLUP HAR","F",5,"106",22,106,34.48,95.8,2,2,
"BBFFG1996005",6,"BFFG",1996005,"08/07/96 00:00:00",1996,8,7,"BGBODD",54.13,54.22,13.43,13.72,0,"FUCU VES","P",51,,0,,34.6,79.3,2,2,
"BBFFG1996006",6,"BFFG",1996006,"05/08/96 00:00:00",1996,5,8,"BPOEL",54.05,54.08,11.3,11.5,0,"FUCU VES","P",51,,0,,12.27,52.8,5,16,
"BBFFG1996007",6,"BFFG",1996007,"10/02/96 00:00:00",1996,10,2,"BPOEL",54.05,54.08,11.3,11.5,0,"FUCU VES","P",51,,0,,19.92,53.7,5,16,
"BBFFG1996008",6,"BFFG",1996008,"10/18/96 00:00:00",1996,10,18,"BGBODD",54.13,54.22,13.43,13.72,0,"FUCU VES","P",51,,0,,18.62,74.90000000000001,2,2,
"BBFFG1996009",6,"BFFG",1996009,"12/14/96 00:00:00",1996,12,14,"BFFG ST06",56.18,56.29,18.1,18.17,37,"GADU MOR","F",5,"21",45,1188,22.42,94.3,4,9,
"BBFFG1996010",6,"BFFG",1996010,"12/13/96 00:00:00",1996,12,13,"BROZE9",55.13,55.21,18.11,18.18,67.5,"GADU MOR","F",5,"13",55,2000,21.51,94.2,4,9,
"BBFFG1996011",6,"BFFG",1996011,"12/17/96 00:00:00",1996,12,17,"BARC2",54.44,54.74,13.59,13.98,36,"GADU MOR","F",5,"11",56,2005,22.37,93.8,2,2,
"BBFFG1996012",6,"BFFG",1996012,"12/11/96 00:00:00",1996,12,11,"BBHOL3",54.38,54.64,15.12,15.21,61.8,"GADU MOR","F",5,"19",49,1342,21.14,94,6,6,
"BBFFG1996013",6,"BFFG",1996013,"12/17/96 00:00:00",1996,12,17,"BARC2",54.46,54.76,13.57,13.95,40,"GADU MOR","F",5,"16",52,1648,20.24,93.09999999999999,2,2,
"BBFFG1996014",6,"BFFG",1996014,"12/08/96 00:00:00",1996,12,8,"BKIBU1",54.33,54.55,10.43,10.72,23,"GADU MOR","F",5,"13",62,2446,29.59,95.40000000000001,5,15,
"BBFFG1996015",6,"BFFG",1996015,"12/15/96 00:00:00",1996,12,15,"BFFG ST03",55.47,55.78,16.45,16.75,47,"GADU MOR","F",5,"12",57,2000,19.76,92.8,4,6,
"BBFFG1996016",6,"BFFG",1996016,"12/12/96 00:00:00",1996,12,12,"BBHOL5",55.11,55.18,16.28,16.46,61.5,"GADU MOR","F",5,"18",49,1361,20.79,93.5,4,6,
"BBFFG1996017",6,"BFFG",1996017,"12/17/96 00:00:00",1996,12,17,"BARC2",54.49,54.81,13.59,13.98,42.5,"GADU MOR","F",5,"17",46,1206,23.42,93.8,2,2,
"BBFFG1996018",6,"BFFG",1996018,"12/10/96 00:00:00",1996,12,10,"BARC2",55.02,55.03,13.29,13.49,46,"GADU MOR","F",5,"18",49,1359,21.37,93.59999999999999,2,2,
"BBFFG1996019",6,"BFFG",1996019,"12/08/96 00:00:00",1996,12,8,"BKIBU1",54.33,54.55,10.43,10.72,23,"GADU MOR","F",18,"13",62,2446,66.23,98.8,5,15,
"BBFFG1996020",6,"BFFG",1996020,"12/10/96 00:00:00",1996,12,10,"BARC2",55.02,55.03,13.29,13.49,46,"GADU MOR","F",18,"18",49,1359,76.92,99.40000000000001,2,2,
"BBFFG1996021",6,"BFFG",1996021,"12/08/96 00:00:00",1996,12,8,"BKIBU1",54.33,54.55,10.43,10.72,23,"MACO BAL","B",43,,0,,9.58,77.3,5,15,
"BBFFG1996022",6,"BFFG",1996022,"10/07/96 00:00:00",1996,10,7,"BPOEL",54.05,54.08,11.3,11.5,0,"MYTI EDU","B",41,,2,1.6,25.25,16.7,5,16,
"BBFFG1996023",6,"BFFG",1996023,"10/07/96 00:00:00",1996,10,7,"BPOEL",54.05,54.08,11.3,11.5,0,"MYTI EDU","B",41,,2,1.4,26.11,17.4,5,16,
"BBFFG1996024",6,"BFFG",1996024,"10/15/96 00:00:00",1996,10,15,"BGBODD",54.13,54.22,13.43,13.72,0,"MYTI EDU","B",41,,2,1.5,24.21,18.7,2,2,
"BBFFG1996025",6,"BFFG",1996025,"05/03/96 00:00:00",1996,5,3,"BPOEL",54.05,54.08,11.3,11.5,0,"MYTI EDU","B",41,,2,1.4,24.1,18.7,5,16,
"BBFFG1996026",6,"BFFG",1996026,"12/13/96 00:00:00",1996,12,13,"BROZE9",55.12,55.21,18.15,18.24,69.3,"SADU ENT","B",41,,0,,22.08,61.7,4,9,
"BBFFG1996027",6,"BFFG",1996027,"12/12/96 00:00:00",1996,12,12,"BBHOL5",55.1,55.17,16.34,16.56,58.3,"SADU ENT","B",41,,0,,21.55,57.4,4,6,
"BBFFG1996028",6,"BFFG",1996028,"12/14/96 00:00:00",1996,12,14,"BFFG ST02",56.13,56.22,18.15,18.26,44,"SPRA SPR","F",1,"610",12,12.1,25,90.59999999999999,4,9,
"BBFFG1996029",6,"BFFG",1996029,"12/10/96 00:00:00",1996,12,10,"BARC2",55.02,55.03,13.29,13.49,46,"SPRA SPR","F",1,"784",11,13.4,32.89,93.40000000000001,2,2,
"BBFFG1996030",6,"BFFG",1996030,"12/18/96 00:00:00",1996,12,18,"BARC2",54.48,54.79,13.18,13.3,45,"CLUP HAR","F",5,"101",24,120,33.56,95.90000000000001,2,2,
"BBFFG1996031",6,"BFFG",1996031,"12/19/96 00:00:00",1996,12,19,"BMEB12",54.18,54.31,11.41,11.68,28,"GADU MOR","F",5,"16",51,1463,22.42,94.2,5,16,
"BBFFG1996032",6,"BFFG",1996032,"12/18/96 00:00:00",1996,12,18,"BARC2",54.48,54.8,13.14,13.24,45,"GADU MOR","F",5,"15",51,1633,20.62,93.59999999999999,2,2,
"BBFFG1996033",6,"BFFG",1996033,"12/13/96 00:00:00",1996,12,13,"BROZE9",55.13,55.21,18.11,18.18,67.5,"GADU MOR","F",18,"13",55,2000,73.53,99.40000000000001,4,9,
"BBFFG1996034",6,"BFFG",1996034,"12/17/96 00:00:00",1996,12,17,"BARC2",54.49,54.81,13.59,13.98,42.5,"GADU MOR","F",18,"17",46,1206,70.92,99.09999999999999,2,2,
"BBFFG1996035",6,"BFFG",1996035,"12/18/96 00:00:00",1996,12,18,"BARC2",54.48,54.8,13.14,13.24,45,"GADU MOR","F",18,"15",51,1633,72.98999999999999,99.3,2,2,
"BBFFG1996036",6,"BFFG",1996036,"12/19/96 00:00:00",1996,12,19,"BMEB12",54.18,54.31,11.41,11.68,28,"GADU MOR","F",18,"16",51,1463,69.44,99.09999999999999,5,16,
"BBFFG1996037",6,"BFFG",1996037,"12/12/96 00:00:00",1996,12,12,"BBHOL5",55.11,55.18,16.28,16.46,61.5,"GADU MOR","F",18,"18",49,1361,76.92,99.5,4,6,
"BBFFG1996038",6,"BFFG",1996038,"12/11/96 00:00:00",1996,12,11,"BBHOL3",54.38,54.64,15.12,15.21,61.8,"GADU MOR","F",18,"19",49,1342,76.92,99.40000000000001,6,6,
"BBFFG1996039",6,"BFFG",1996039,"12/15/96 00:00:00",1996,12,15,"BFFG ST03",55.47,55.78,16.45,16.75,47,"GADU MOR","F",18,"12",57,2000,72.98999999999999,99.40000000000001,4,6,
"BBFFG1996040",6,"BFFG",1996040,"12/14/96 00:00:00",1996,12,14,"BFFG ST06",56.18,56.29,18.1,18.17,37,"GADU MOR","F",18,"21",45,1188,76.92,99.40000000000001,4,9,
"BBFFG1996041",6,"BFFG",1996041,"12/17/96 00:00:00",1996,12,17,"BARC2",54.46,54.76,13.57,13.95,40,"GADU MOR","F",18,"16",52,1648,75.19,99.40000000000001,2,2,
"BBFFG1996042",6,"BFFG",1996042,"12/17/96 00:00:00",1996,12,17,"BARC2",54.44,54.74,13.59,13.98,36,"GADU MOR","F",18,"11",56,2005,65.79000000000001,99,2,2,
"BBFFG1996043",6,"BFFG",1996043,"12/17/96 00:00:00",1996,12,17,"BARC2",54.46,54.76,13.57,13.95,40,"PLAT FLE","F",5,"26",34,615,14.01,91.7,2,2,
"BBFFG1996044",6,"BFFG",1996044,"12/17/96 00:00:00",1996,12,17,"BARC2",54.5,54.83,14.02,14.04,42,"PLAT FLE","F",5,"8",31,438,22.88,94.90000000000001,2,2,
"BBFFG1996045",6,"BFFG",1996045,"12/17/96 00:00:00",1996,12,17,"BARC2",54.49,54.81,13.59,13.98,42.5,"PLAT FLE","F",5,"20",31,495,22.73,94.8,2,2,
"BBFFG1996046",6,"BFFG",1996046,"12/16/96 00:00:00",1996,12,16,"BFFG ST04",55.42,55.7,16.44,16.74,49.3,"PLAT FLE","F",5,"21",33,571,22.37,95.2,4,6,
"BBFFG1996047",6,"BFFG",1996047,"12/14/96 00:00:00",1996,12,14,"BFFG ST05",56.17,56.28,18.17,18.29,41.4,"PLAT FLE","F",5,"23",34,674,24.33,95.3,4,9,
"BBFFG1996048",6,"BFFG",1996048,"12/11/96 00:00:00",1996,12,11,"BBHOL3",54.38,54.64,15.15,15.25,62.6,"PLAT FLE","F",5,"30",31,403,23.47,95.40000000000001,6,6,
"BBFFG1996049",6,"BFFG",1996049,"12/11/96 00:00:00",1996,12,11,"BBHOL3",54.38,54.64,15.14,15.24,62.4,"PLEU PLA","F",5,"40",29,366,21.51,95.40000000000001,6,6,
"BBFFG1996050",6,"BFFG",1996050,"12/12/96 00:00:00",1996,12,12,"BBHOL5",55.1,55.17,16.34,16.56,59.5,"PLEU PLA","F",5,"14",43,1159,18.38,94.90000000000001,4,6,
"BBFFG1996051",6,"BFFG",1996051,"12/08/96 00:00:00",1996,12,8,"BKIBU1",54.33,54.55,10.45,10.76,23,"PLEU PLA","F",5,"26",32,426,20.96,94.59999999999999,5,15,
"BBFFG1997001",6,"BFFG",1997001,"12/06/97 00:00:00",1997,12,6,"BKIBU1",54.31,54.52,10.34,10.57,17.9,"GADU MOR","F",5,"12",59,2108,19.27,93.09999999999999,5,15,
"BBFFG1997002",6,"BFFG",1997002,"12/09/97 00:00:00",1997,12,9,"BBHOL3",54.35,54.59,15.04,15.06,50.9,"GADU MOR","F",5,"9",58,2189,20.53,93.8,6,6,
"BBFFG1997003",6,"BFFG",1997003,"12/12/97 00:00:00",1997,12,12,"BBHOL5",55.06,55.1,16.35,16.59,46.8,"GADU MOR","F",5,"15",51,1440,23.04,94.59999999999999,4,6,
"BBFFG1997004",6,"BFFG",1997004,"12/09/97 00:00:00",1997,12,9,"BROZE9",55.13,55.22,18.12,18.2,65,"GADU MOR","F",5,"9",64,2622,20.92,93.90000000000001,4,9,
"BBFFG1997005",6,"BFFG",1997005,"12/08/97 00:00:00",1997,12,8,"BARC2",54.46,54.76,13.56,13.94,38.3,"GADU MOR","F",5,"5",67,3340,19.38,93.40000000000001,2,2,
"BBFFG1997006",6,"BFFG",1997006,"12/07/97 00:00:00",1997,12,7,"BARC2",54.46,54.76,13.13,13.21,36.2,"GADU MOR","F",5,"14",52,1607,19.72,93.40000000000001,2,2,
"BBFFG1997007",6,"BFFG",1997007,"12/13/97 00:00:00",1997,12,13,"BMEB12",54.14,54.23,11.41,11.68,26.6,"GADU MOR","F",5,"15",49,1245,19.76,93.09999999999999,5,16,
"BBFFG1997008",6,"BFFG",1997008,"12/09/97 00:00:00",1997,12,9,"BBHOL3",54.37,54.61,15.08,15.13,54.9,"PLAT FLE","F",5,"27",35,652,26.39,95.40000000000001,6,6,
"BBFFG1997009",6,"BFFG",1997009,"12/08/97 00:00:00",1997,12,8,"BARC2",54.48,54.79,13.58,13.96,40.2,"PLAT FLE","F",5,"25",35,644,22.17,94.5,2,2,
"BBFFG1997010",6,"BFFG",1997010,"12/07/97 00:00:00",1997,12,7,"BARC2",54.48,54.8,13.17,13.29,44.4,"PLAT FLE","F",5,"28",35,668,23.98,94.59999999999999,2,2,
"BBFFG1997011",6,"BFFG",1997011,"12/07/97 00:00:00",1997,12,7,"BARC2",54.49,54.82,13.17,13.28,45.5,"CLUP HAR","F",5,"67",24,193,32.68,95.7,2,2,
"BBFFG1997012",6,"BFFG",1997012,"12/09/97 00:00:00",1997,12,9,"BBHOL3",54.36,54.6,15.07,15.12,53.2,"PLEU PLA","F",5,"34",31,435,21.14,94.8,6,6,
"BBFFG1997013",6,"BFFG",1997013,"12/12/97 00:00:00",1997,12,12,"BBHOL5",55.06,55.1,16.35,16.58,48.4,"PLEU PLA","F",5,"12",47,1563,19.92,95.59999999999999,4,6,
"BBFFG1997014",6,"BFFG",1997014,"12/07/97 00:00:00",1997,12,7,"BARC2",54.48,54.79,13.16,13.27,42.4,"PLEU PLA","F",5,"16",38,850,17.89,94.59999999999999,2,2,
"BBFFG1997015",6,"BFFG",1997015,"12/08/97 00:00:00",1997,12,8,"BARC2",54.49,54.82,13.59,13.98,42,"SPRA SPR","F",1,"1723",7,3.8,25.06,91.09999999999999,2,2,
"BBFFG1997016",6,"BFFG",1997016,"12/06/97 00:00:00",1997,12,6,"BKIBU1",54.32,54.54,10.4,10.67,20.3,"RHODOPHY","P",51,,0,,12.94,50.2,5,15,
"BBFFG1997017",6,"BFFG",1997017,"12/06/97 00:00:00",1997,12,6,"BKIBU1",54.33,54.54,10.42,10.71,20.9,"LAMI SAC","P",51,,0,,13.39,76.3,5,15,
"BBFFG1997018",6,"BFFG",1997018,"12/06/97 00:00:00",1997,12,6,"BKIBU1",54.31,54.52,10.34,10.57,17.9,"GADU MOR","F",18,"12",59,2108,59.88,98.59999999999999,5,15,
"BBFFG1997019",6,"BFFG",1997019,"12/07/97 00:00:00",1997,12,7,"BARC2",54.46,54.76,13.13,13.21,36.2,"GADU MOR","F",18,"14",52,1607,73.53,99.3,2,2,
"BBFFG1997020",6,"BFFG",1997020,"12/08/97 00:00:00",1997,12,8,"BARC2",54.46,54.76,13.56,13.94,38.3,"GADU MOR","F",18,"5",67,3340,74.63,99.3,2,2,
"BBFFG1997021",6,"BFFG",1997021,"12/09/97 00:00:00",1997,12,9,"BBHOL3",54.35,54.59,15.04,15.06,50.9,"GADU MOR","F",18,"9",58,2189,72.98999999999999,99.3,6,6,
"BBFFG1997022",6,"BFFG",1997022,"12/10/97 00:00:00",1997,12,10,"BROZE9",55.13,55.22,18.12,18.2,65,"GADU MOR","F",18,"9",64,2622,72.45999999999999,99.40000000000001,4,9,
"BBFFG1997023",6,"BFFG",1997023,"12/12/97 00:00:00",1997,12,12,"BBHOL5",55.06,55.1,16.35,16.59,46.8,"GADU MOR","F",18,"15",51,1440,76.92,99.40000000000001,4,6,
"BBFFG1997024",6,"BFFG",1997024,"12/13/97 00:00:00",1997,12,13,"BMEB12",54.14,54.23,11.41,11.68,26.6,"GADU MOR","F",18,"15",49,1245,68.97,99,5,16,
"BBFFG1997025",6,"BFFG",1997025,"07/10/97 00:00:00",1997,7,10,"BGBODD",54.13,54.22,13.43,13.72,0,"FUCU VES","P",51,,0,,24.45,79.5,2,2,
"BBFFG1997026",6,"BFFG",1997026,"11/03/97 00:00:00",1997,11,3,"BGBODD",54.13,54.22,13.43,13.72,0,"FUCU VES","P",51,,0,,11.6,58.2,2,2,
"BBFFG1997027",6,"BFFG",1997027,"06/10/97 00:00:00",1997,6,10,"BPOEL",54.05,54.08,11.3,11.5,0,"FUCU VES","P",51,,0,,15.87,73.3,5,16,
"BBFFG1997028",6,"BFFG",1997028,"09/22/97 00:00:00",1997,9,22,"BPOEL",54.05,54.08,11.3,11.5,0,"FUCU VES","P",51,,0,,20.41,77.2,5,16,
"BBFFG1997029",6,"BFFG",1997029,"07/10/97 00:00:00",1997,7,10,"BGBODD",54.13,54.22,13.43,13.72,0,"MYTI EDU","B",41,,3,3,32.68,16.7,2,2,
"BBFFG1997030",6,"BFFG",1997030,"11/03/97 00:00:00",1997,11,3,"BGBODD",54.13,54.22,13.43,13.72,0,"MYTI EDU","B",41,,0,,36.1,15.2,2,2,
"BBFFG1997031",6,"BFFG",1997031,"06/10/97 00:00:00",1997,6,10,"BPOEL",54.05,54.08,11.3,11.5,0,"MYTI EDU","B",41,,3,1.4,44.44,16,5,16,
"BBFFG1997032",6,"BFFG",1997032,"09/18/97 00:00:00",1997,9,18,"BPOEL",54.05,54.08,11.3,11.5,0,"MYTI EDU","B",41,,0,,45.05,15.2,5,16,
"BBFFG1998001",6,"BFFG",1998001,"05/15/98 00:00:00",1998,5,15,"BGBODD",54.13,54.22,13.43,13.72,0,"FUCU VES","P",51,,0,,15.87,76.40000000000001,2,2,
"BBFFG1998002",6,"BFFG",1998002,"10/12/98 00:00:00",1998,10,12,"BGBODD",54.13,54.22,13.43,13.72,0,"FUCU VES","P",51,,0,,17.45,78.7,2,2,
"BBFFG1998003",6,"BFFG",1998003,"07/16/98 00:00:00",1998,7,16,"BPOEL",54.05,54.08,11.3,11.5,0,"FUCU VES","P",51,,0,,14.53,60.6,5,16,
"BBFFG1998004",6,"BFFG",1998004,"10/19/98 00:00:00",1998,10,19,"BPOEL",54.05,54.08,11.3,11.5,0,"FUCU VES","P",51,,0,,15.85,75.09999999999999,5,16,
"BBFFG1998005",6,"BFFG",1998005,"12/15/98 00:00:00",1998,12,15,"BIKUB1",54.32,54.53,10.38,10.64,19.4,"MACO BAL","B",43,,6,,6.04,72.59999999999999,5,15,
"BBFFG1998006",6,"BFFG",1998006,"05/10/98 00:00:00",1998,5,10,"BIKUB1",54.32,54.54,10.43,10.72,22,"MACO BAL","B",43,"122",6,54,10.28,75.8,5,15,
"BBFFG1998007",6,"BFFG",1998007,"05/15/98 00:00:00",1998,5,15,"BGBODD",54.13,54.22,13.43,13.72,0,"MYTI EDU","B",41,,0,,34.97,22.5,2,2,
"BBFFG1998008",6,"BFFG",1998008,"10/12/98 00:00:00",1998,10,12,"BGBODD",54.13,54.22,13.43,13.72,0,"MYTI EDU","B",41,,0,,40.65,16.7,2,2,
"BBFFG1998009",6,"BFFG",1998009,"12/15/98 00:00:00",1998,12,15,"BIKUB1",54.36,54.6,10.31,10.52,0,"RHODOPHY","P",51,,0,,18.35,58.7,5,15,
"BBFFG1998010",6,"BFFG",1998010,"05/09/98 00:00:00",1998,5,9,"BMEB12",54.13,54.21,11.36,11.6,25.5,"RHODOPHY","P",51,,0,,13.48,59,5,16,
"BBFFG1998011",6,"BFFG",1998011,"05/10/98 00:00:00",1998,5,10,"BIKUB1",54.32,54.54,10.44,10.73,21.8,"GADU MOR","F",5,"9",63,2472,19.42,93.3,5,15,
"BBFFG1998012",6,"BFFG",1998012,"12/15/98 00:00:00",1998,12,15,"BIKUB1",54.32,54.53,10.36,10.59,17.4,"GADU MOR","F",5,"7",66,2950,21.6,94.09999999999999,5,15,
"BBFFG1998013",6,"BFFG",1998013,"12/17/98 00:00:00",1998,12,17,"BBHOL3",54.38,54.63,15.09,15.15,58.3,"GADU MOR","F",5,"20",46,1070,21.14,94,6,6,
"BBFFG1998014",6,"BFFG",1998014,"12/19/98 00:00:00",1998,12,19,"BBHOL5",55.13,55.21,16.32,16.53,64.90000000000001,"GADU MOR","F",5,"24",47,1065,20.53,93.7,4,6,
"BBFFG1998015",6,"BFFG",1998015,"12/18/98 00:00:00",1998,12,18,"BROZE9",55.13,55.21,18.13,18.22,68.40000000000001,"GADU MOR","F",5,"3",100,7857,18.35,93.7,4,9,
"BBFFG1998016",6,"BFFG",1998016,"12/20/98 00:00:00",1998,12,20,"BARC2",54.47,54.78,13.56,13.94,41.5,"GADU MOR","F",5,"10",55,1973,20.79,93.90000000000001,2,2,
"BBFFG1998017",6,"BFFG",1998017,"12/16/98 00:00:00",1998,12,16,"BARC2",54.45,54.75,13.16,13.27,37.3,"GADU MOR","F",5,"5",69,3876,25.32,95,2,2,
"BBFFG1998018",6,"BFFG",1998018,"05/09/98 00:00:00",1998,5,9,"BMEB12",54.16,54.26,11.44,11.73,25.8,"GADU MOR","F",5,"11",56,1800,18.98,93.2,5,16,
"BBFFG1998019",6,"BFFG",1998019,"12/21/98 00:00:00",1998,12,21,"BMEB12",54.19,54.32,11.41,11.68,26.6,"GADU MOR","F",5,"4",68,3840,20.08,93.59999999999999,5,16,
"BBFFG1998020",6,"BFFG",1998020,"05/10/98 00:00:00",1998,5,10,"BIKUB1",54.32,54.54,10.44,10.73,21.8,"GADU MOR","F",18,"9",63,2472,57.8,98.7,5,15,
"BBFFG1998021",6,"BFFG",1998021,"12/15/98 00:00:00",1998,12,15,"BIKUB1",54.32,54.53,10.36,10.59,17.4,"GADU MOR","F",18,"7",66,2950,50.25,98.2,5,15,
"BBFFG1998022",6,"BFFG",1998022,"12/17/98 00:00:00",1998,12,17,"BBHOL3",54.38,54.63,15.09,15.15,58.3,"GADU MOR","F",18,"20",46,1070,68.48999999999999,99.09999999999999,6,6,
"BBFFG1998023",6,"BFFG",1998023,"12/19/98 00:00:00",1998,12,19,"BBHOL5",55.13,55.21,16.32,16.53,64.90000000000001,"GADU MOR","F",18,"24",47,1065,69.93000000000001,99.3,4,6,
"BBFFG1998024",6,"BFFG",1998024,"12/18/98 00:00:00",1998,12,18,"BROZE9",55.13,55.21,18.13,18.22,68.40000000000001,"GADU MOR","F",18,"3",100,7857,60.24,98.7,4,9,
"BBFFG1998025",6,"BFFG",1998025,"12/20/98 00:00:00",1998,12,20,"BARC2",54.47,54.78,13.56,13.94,41.5,"GADU MOR","F",18,"10",55,1973,64.09999999999999,98.59999999999999,2,2,
"BBFFG1998026",6,"BFFG",1998026,"12/16/98 00:00:00",1998,12,16,"BARC2",54.45,54.75,13.16,13.27,37.3,"GADU MOR","F",18,"5",69,3876,63.69,98.8,2,2,
"BBFFG1998027",6,"BFFG",1998027,"05/09/98 00:00:00",1998,5,9,"BMEB12",54.16,54.26,11.44,11.73,25.8,"GADU MOR","F",18,"11",56,1800,64.09999999999999,99,5,16,
"BBFFG1998028",6,"BFFG",1998028,"12/21/98 00:00:00",1998,12,21,"BMEB12",54.19,54.32,11.41,11.68,26.6,"GADU MOR","F",18,"4",68,3840,64.09999999999999,98.59999999999999,5,16,
"BBFFG1998029",6,"BFFG",1998029,"12/15/98 00:00:00",1998,12,15,"BIKUB1",54.32,54.54,10.4,10.66,20.1,"PLAT FLE","F",5,"13",36,750,23.7,94.59999999999999,5,15,
"BBFFG1998030",6,"BFFG",1998030,"12/18/98 00:00:00",1998,12,18,"BROZE9",55.1,55.17,18.25,18.41,84.59999999999999,"PLAT FLE","F",5,"16",34,530,28.99,95.8,4,9,
"BBFFG1998031",6,"BFFG",1998031,"12/20/98 00:00:00",1998,12,20,"BARC2",54.47,54.78,13.56,13.94,41.5,"PLAT FLE","F",5,"22",33,492,23.42,94.59999999999999,2,2,
"BBFFG1998032",6,"BFFG",1998032,"12/16/98 00:00:00",1998,12,16,"BARC2",54.48,54.79,13.15,13.25,42.3,"CLUP HAR","F",5,"80",23,137,41.15,96.5,2,2,
"BBFFG1998033",6,"BFFG",1998033,"05/09/98 00:00:00",1998,5,9,"BMEB12",54.14,54.24,11.42,11.7,25.9,"CLUP HAR","F",5,"99",22,107,22.47,92.8,5,16,
"BBFFG1998034",6,"BFFG",1998034,"12/15/98 00:00:00",1998,12,15,"BIKUB1",54.32,54.54,10.4,10.66,20.1,"PLEU PLA","F",5,"19",32,433,22.47,94.5,5,15,
"BBFFG1998035",6,"BFFG",1998035,"12/19/98 00:00:00",1998,12,19,"BBHOL5",55.13,55.21,16.32,16.53,64.90000000000001,"PLEU PLA","F",5,"13",39,744,20.88,94.5,4,6,
"BBFFG1999001",6,"BFFG",1999001,"06/15/99 00:00:00",1999,6,15,"BGBODD",54.13,54.22,13.43,13.72,0,"FUCU VES","P",51,,0,,16.92,72.7,2,2,
"BBFFG1999002",6,"BFFG",1999002,"10/19/99 00:00:00",1999,10,19,"BGBODD",54.13,54.22,13.43,13.72,0,"FUCU VES","P",51,,0,,7.46,71.7,2,2,
"BBFFG1999003",6,"BFFG",1999003,"06/15/99 00:00:00",1999,6,15,"BGBODD",54.13,54.22,13.43,13.72,0,"MYTI EDU","B",41,,0,,35.59,17.4,2,2,
"BBFFG1999004",6,"BFFG",1999004,"06/15/99 00:00:00",1999,6,15,"BGBODD",54.13,54.22,13.43,13.72,0,"MYTI EDU","B",41,,0,,34.6,16.7,2,2,
"BBFFG1999005",6,"BFFG",1999005,"10/19/99 00:00:00",1999,10,19,"BGBODD",54.13,54.22,13.43,13.72,0,"MYTI EDU","B",41,,0,,30.67,14.5,2,2,
"BBFFG1999006",6,"BFFG",1999006,"10/19/99 00:00:00",1999,10,19,"BGBODD",54.13,54.22,13.43,13.72,0,"MYTI EDU","B",41,,0,,28.74,14.5,2,2,
"BBFFG1999007",6,"BFFG",1999007,"09/02/99 00:00:00",1999,9,2,"BKIBU1",54.31,54.52,10.35,10.58,10.4,"GADU MOR","F",5,"11",56,1523,18.73,92.8,5,15,
"BBFFG1999008",6,"BFFG",1999008,"09/04/99 00:00:00",1999,9,4,"BMEB12",54.14,54.23,11.41,11.69,25.8,"GADU MOR","F",5,"22",45,823,19.08,93,5,16,
"BBFFG1999009",6,"BFFG",1999009,"12/11/99 00:00:00",1999,12,11,"BKIBU1",54.36,54.6,10.2,10.33,18.9,"GADU MOR","F",5,"10",59,2240,19.49,93,5,15,
"BBFFG1999010",6,"BFFG",1999010,"12/12/99 00:00:00",1999,12,12,"BARC2",54.47,54.78,13.14,13.24,39.2,"GADU MOR","F",5,"8",56,2103,20,93.09999999999999,2,2,
"BBFFG1999011",6,"BFFG",1999011,"12/13/99 00:00:00",1999,12,13,"BBHOL3",54.38,54.64,15.03,15.05,56.7,"GADU MOR","F",5,"8",61,2064,19.76,93.3,6,6,
"BBFFG1999012",6,"BFFG",1999012,"12/14/99 00:00:00",1999,12,14,"BROZE9",55.13,55.22,18.12,18.21,67,"GADU MOR","F",5,"3",93,7717,19.23,93.5,4,9,
"BBFFG1999013",6,"BFFG",1999013,"12/15/99 00:00:00",1999,12,15,"BBHOL5",55.13,55.22,16.37,16.61,65.2,"GADU MOR","F",5,"3",91,7497,19.72,93.40000000000001,4,6,
"BBFFG1999014",6,"BFFG",1999014,"12/16/99 00:00:00",1999,12,16,"BARC2",54.39,54.65,14.05,14.08,25.6,"GADU MOR","F",5,"4",85,6945,19.27,93.2,2,2,
"BBFFG1999015",6,"BFFG",1999015,"12/17/99 00:00:00",1999,12,17,"BARC2",54.57,54.94,13.32,13.54,50.5,"GADU MOR","F",5,"10",50,1440,19.84,93.3,2,2,
"BBFFG1999016",6,"BFFG",1999016,"12/18/99 00:00:00",1999,12,18,"BMEB12",54.13,54.22,11.39,11.65,25.8,"GADU MOR","F",5,"14",50,1571,19.01,92.8,5,16,
"BBFFG1999017",6,"BFFG",1999017,"09/02/99 00:00:00",1999,9,2,"BKIBU1",54.31,54.52,10.35,10.58,10.4,"GADU MOR","F",18,"11",56,1523,60.98,98.40000000000001,5,15,
"BBFFG1999018",6,"BFFG",1999018,"09/04/99 00:00:00",1999,9,4,"BMEB12",54.14,54.23,11.41,11.69,25.8,"GADU MOR","F",18,"22",45,823,65.79000000000001,99,5,16,
"BBFFG1999019",6,"BFFG",1999019,"12/11/99 00:00:00",1999,12,11,"BKIBU1",54.36,54.6,10.2,10.33,18.9,"GADU MOR","F",18,"10",59,2240,66.67,99,5,15,
"BBFFG1999020",6,"BFFG",1999020,"12/12/99 00:00:00",1999,12,12,"BARC2",54.47,54.78,13.14,13.24,39.2,"GADU MOR","F",18,"8",56,2103,75.76000000000001,99.3,2,2,
"BBFFG1999021",6,"BFFG",1999021,"12/13/99 00:00:00",1999,12,13,"BBHOL3",54.38,54.64,15.03,15.05,56.7,"GADU MOR","F",18,"8",61,2064,77.52,99.40000000000001,6,6,
"BBFFG1999022",6,"BFFG",1999022,"12/14/99 00:00:00",1999,12,14,"BROZE9",55.13,55.22,18.12,18.21,67,"GADU MOR","F",18,"3",93,7717,70.42,98.90000000000001,4,9,
"BBFFG1999023",6,"BFFG",1999023,"12/15/99 00:00:00",1999,12,15,"BBHOL5",55.13,55.22,16.37,16.61,65.2,"GADU MOR","F",18,"3",91,7497,70.42,99.2,4,6,
"BBFFG1999024",6,"BFFG",1999024,"12/16/99 00:00:00",1999,12,16,"BARC2",54.39,54.65,14.05,14.08,25.6,"GADU MOR","F",18,"4",85,6945,60.61,98,2,2,
"BBFFG1999025",6,"BFFG",1999025,"12/17/99 00:00:00",1999,12,17,"BARC2",54.57,54.94,13.33,13.54,50.5,"GADU MOR","F",18,"10",50,1440,77.52,99.3,2,2,
"BBFFG1999026",6,"BFFG",1999026,"12/18/99 00:00:00",1999,12,18,"BMEB12",54.13,54.22,11.39,11.65,25.8,"GADU MOR","F",18,"14",50,1571,72.45999999999999,99.09999999999999,5,16,
"BBFFG1999027",6,"BFFG",1999027,"12/12/99 00:00:00",1999,12,12,"BARC2",54.47,54.79,13.14,13.23,42.2,"PLEU PLA","F",5,"18",32,491,20.37,94.2,2,2,
"BBFFG1999028",6,"BFFG",1999028,"12/15/99 00:00:00",1999,12,15,"BBHOL5",55.06,55.1,16.31,16.52,53.8,"PLEU PLA","F",5,"8",48,1518,19.23,94.59999999999999,4,6,
"BBFFG2000001",6,"BFFG",2000001,"05/15/00 00:00:00",2000,5,15,"BGBODD",54.13,54.22,13.43,13.72,0,"FUCU VES","P",51,,0,,11.45,75.7,2,2,
"BBFFG2000002",6,"BFFG",2000002,"10/15/00 00:00:00",2000,10,15,"BGBODD",54.13,54.22,13.43,13.72,0,"FUCU VES","P",51,,0,,15.38,95.90000000000001,2,2,
"BBFFG2000003",6,"BFFG",2000003,"05/15/00 00:00:00",2000,5,15,"BGBODD",54.13,54.22,13.43,13.72,0,"MYTI EDU","B",41,,0,,41.67,22.5,2,2,
"BBFFG2000004",6,"BFFG",2000004,"10/15/00 00:00:00",2000,10,15,"BGBODD",54.13,54.22,13.43,13.72,0,"MYTI EDU","B",41,,0,,35.97,16,2,2,
"BBFFG2000005",6,"BFFG",2000005,"12/06/00 00:00:00",2000,12,6,"BARC2",54.36,54.6,14.09,14.15,22.8,"MYTI EDU","B",41,,0,,23.87,22.5,2,2,
"BBFFG2000006",6,"BFFG",2000006,"09/05/00 00:00:00",2000,9,5,"BKIBU1",54.39,54.65,10.3,10.51,19.7,"GADU MOR","F",5,"3",90,7033,19.38,93.5,5,15,
"BBFFG2000007",6,"BFFG",2000007,"09/06/00 00:00:00",2000,9,6,"BARC2",54.45,54.75,14.04,14.07,32.8,"GADU MOR","F",5,"8",58,2263,20.16,93.5,2,2,
"BBFFG2000008",6,"BFFG",2000008,"09/07/00 00:00:00",2000,9,7,"BARC2",54.46,54.77,13.15,13.25,40.4,"GADU MOR","F",5,"19",45,1035,20.96,93.59999999999999,2,2,
"BBFFG2000009",6,"BFFG",2000009,"12/02/00 00:00:00",2000,12,2,"BARC2",54.47,54.79,13.15,13.25,42.3,"GADU MOR","F",5,"14",45,991,20.28,93.5,2,2,
"BBFFG2000010",6,"BFFG",2000010,"12/03/00 00:00:00",2000,12,3,"BBHOL3",54.39,54.65,15.13,15.21,60.9,"GADU MOR","F",5,"14",46,1143,20.16,93.59999999999999,6,6,
"BBFFG2000011",6,"BFFG",2000011,"12/04/00 00:00:00",2000,12,4,"BROZE9",55.11,55.19,18.13,18.22,65.8,"GADU MOR","F",5,"3",85,6067,23.53,94.5,4,9,
"BBFFG2000012",6,"BFFG",2000012,"12/05/00 00:00:00",2000,12,5,"BBHOL5",55.13,55.21,16.35,16.58,63.4,"GADU MOR","F",5,"2",83,5825,22.12,94.09999999999999,4,6,
"BBFFG2000013",6,"BFFG",2000013,"12/06/00 00:00:00",2000,12,6,"BARC2",54.41,54.69,14.04,14.07,27.8,"GADU MOR","F",5,"17",46,1108,20.62,93.8,2,2,
"BBFFG2000014",6,"BFFG",2000014,"12/07/00 00:00:00",2000,12,7,"BARC2",54.57,54.96,13.35,13.58,47.6,"GADU MOR","F",5,"16",43,991,20.41,93.59999999999999,2,2,
"BBFFG2000015",6,"BFFG",2000015,"12/08/00 00:00:00",2000,12,8,"BMEB12",54.15,54.25,11.39,11.66,25.9,"GADU MOR","F",5,"10",52,1542,18.94,93,5,16,
"BBFFG2000016",6,"BFFG",2000016,"12/09/00 00:00:00",2000,12,9,"BKIBU1",54.38,54.63,10.25,10.41,19.8,"GADU MOR","F",5,"14",50,1349,19.49,92.8,5,15,
"BBFFG2000017",6,"BFFG",2000017,"12/04/00 00:00:00",2000,12,4,"BROZE9",55.11,55.19,18.13,18.22,65.8,"GADU MOR","F",5,"1",127,22500,32.57,96.59999999999999,4,9,
"BBFFG2000018",6,"BFFG",2000018,"09/05/00 00:00:00",2000,9,5,"BKIBU1",54.39,54.65,10.3,10.51,19.7,"GADU MOR","F",18,"3",90,7033,68.97,99.09999999999999,5,15,
"BBFFG2000019",6,"BFFG",2000019,"09/06/00 00:00:00",2000,9,6,"BARC2",54.45,54.75,14.04,14.07,32.8,"GADU MOR","F",18,"8",58,2263,74.63,99.40000000000001,2,2,
"BBFFG2000020",6,"BFFG",2000020,"09/07/00 00:00:00",2000,9,7,"BARC2",54.46,54.77,13.15,13.25,40.4,"GADU MOR","F",18,"19",45,1035,75.76000000000001,99.40000000000001,2,2,
"BBFFG2000021",6,"BFFG",2000021,"12/02/00 00:00:00",2000,12,2,"BARC2",54.47,54.79,13.15,13.25,42.3,"GADU MOR","F",18,"14",45,991,70.42,99.40000000000001,2,2,
"BBFFG2000022",6,"BFFG",2000022,"12/03/00 00:00:00",2000,12,3,"BBHOL3",54.39,54.65,15.13,15.21,60.9,"GADU MOR","F",18,"14",46,1143,73.53,99.3,6,6,
"BBFFG2000023",6,"BFFG",2000023,"12/04/00 00:00:00",2000,12,4,"BROZE9",55.11,55.19,18.13,18.22,65.8,"GADU MOR","F",18,"3",85,6067,74.06999999999999,99.40000000000001,4,9,
"BBFFG2000024",6,"BFFG",2000024,"12/05/00 00:00:00",2000,12,5,"BBHOL5",55.13,55.21,16.35,16.58,63.4,"GADU MOR","F",18,"2",83,5825,74.06999999999999,99.3,4,6,
